publication,scraped_datetime,Headline,Url,Rank
ABC News,2024_06_13_07,New species of flying pterosaur reptile discovered in outback Queensland fossil dig - ABC News,https://news.google.com/rss/articles/CBMicGh0dHBzOi8vd3d3LmFiYy5uZXQuYXUvbmV3cy8yMDI0LTA2LTEzL25ldy1zcGVjaWVzLXB0ZXJvc2F1ci1mb3NzaWwtZmluZC1rcm9ub3NhdXJ1cy1rb3JuZXItcXVlZW5zbGFuZC8xMDM5NjcwMjjSAShodHRwczovL2FtcC5hYmMubmV0LmF1L2FydGljbGUvMTAzOTY3MDI4?oc=5&hl=en-US&gl=US&ceid=US:en,32
Mirage News,2024_06_13_07,"Supercomputers Offer Cosmic Preview to Rubin Observatory, Roman Telescope - Mirage News",https://news.google.com/rss/articles/CBMiUGh0dHBzOi8vd3d3Lm1pcmFnZW5ld3MuY29tL3N1cGVyY29tcHV0ZXJzLW9mZmVyLWNvc21pYy1wcmV2aWV3LXRvLXJ1YmluLTEyNTQ3NjIv0gEA?oc=5&hl=en-US&gl=US&ceid=US:en,33
News-Medical.Net,2024_06_13_07,'I try to stay strong': Mom struggles to get diagnosis for son's developmental problems - News-Medical.Net,https://news.google.com/rss/articles/CBMilQFodHRwczovL3d3dy5uZXdzLW1lZGljYWwubmV0L25ld3MvMjAyNDA2MTIvZTI4MDk4SS10cnktdG8tc3RheS1zdHJvbmdlMjgwOTktTW9tLXN0cnVnZ2xlcy10by1nZXQtZGlhZ25vc2lzLWZvci1zb25lMjgwOTlzLWRldmVsb3BtZW50YWwtcHJvYmxlbXMuYXNweNIBAA?oc=5&hl=en-US&gl=US&ceid=US:en,34
ABC News,2024_06_13_07,"Poultry farmers urge backyard chicken owners to implement biosecurity measures, help curb bird flu - ABC News",https://news.google.com/rss/articles/CBMidGh0dHBzOi8vd3d3LmFiYy5uZXQuYXUvbmV3cy9ydXJhbC8yMDI0LTA2LTEzL3BvdWx0cnktZmFybWVycy11cmdlLWJhY2t5YXJkLWNoaWNrZW4tb3duZXJzLXRvLWN1cmItYmlyZC1mbHUvMTAzOTY3MDM00gEA?oc=5&hl=en-US&gl=US&ceid=US:en,35
Yahoo News Australia,2024_06_13_07,WHO confirms rare human case of bird flu infection in India - Yahoo News Australia,https://news.google.com/rss/articles/CBMiRmh0dHBzOi8vYXUubmV3cy55YWhvby5jb20vY29uZmlybXMtcmFyZS1odW1hbi1jYXNlLWJpcmQtMDYxMzA4OTc2Lmh0bWzSAQA?oc=5&hl=en-US&gl=US&ceid=US:en,36
Medical Xpress,2024_06_13_07,"Australians are living longer, but in need of more support - Medical Xpress",https://news.google.com/rss/articles/CBMiPmh0dHBzOi8vbWVkaWNhbHhwcmVzcy5jb20vbmV3cy8yMDI0LTA2LWF1c3RyYWxpYW5zLWxvbmdlci5odG1s0gEA?oc=5&hl=en-US&gl=US&ceid=US:en,37
