publication,scraped_datetime,Headline,Url,Rank
SMH,2024_06_15_00,Cloud-seeding program over Snowy Hydro suspended,https://www.smh.com.au/national/nsw/cloud-seeding-program-over-snowy-hydro-suspended-20240613-p5jlgb.html,1
SMH,2024_06_15_00,Parents left in the dark after principal and deputies leave north shore school,https://www.smh.com.au/national/nsw/parents-left-in-the-dark-after-principal-and-deputies-leave-north-shore-school-20240614-p5jlu0.html,2
SMH,2024_06_15_00,The MP with four jobs and the multimillion-dollar property development,https://www.smh.com.au/national/nsw/the-mp-with-four-jobs-and-the-multimillion-dollar-property-development-20240613-p5jlib.html,3
SMH,2024_06_15_00,Australia news as it happened: G7 summit opens with deal to use Russian assets for Ukraine; Coalition to push for social media reform,https://www.smh.com.au/national/australia-news-live-g7-summit-opens-with-deal-to-use-russian-assets-for-ukraine-coalition-to-push-for-laws-forcing-social-media-to-check-users-ages-20240614-p5jlpq.html,4
SMH,2024_06_15_00,Independents fight for survival as Sydney’s election battlelines redrawn,https://www.smh.com.au/politics/federal/federal-seat-of-north-sydney-to-be-abolished-20240614-p5jlql.html,5
SMH,2024_06_15_00,"It seemed a simple kiss on TV after the game, but it crossed a boundary",https://www.smh.com.au/lifestyle/life-and-relationships/it-seemed-a-simple-kiss-on-tv-after-the-game-but-it-crossed-a-boundary-20240613-p5jlkv.html,6
SMH,2024_06_15_00,Simpson swam fast enough to make Australia’s Olympic team. He was in the wrong race,https://www.smh.com.au/sport/swimming/simpson-swam-fast-enough-to-make-australia-s-olympic-team-he-was-in-the-wrong-race-20240613-p5jlp6.html,7
SMH,2024_06_15_00,The world’s 50 greatest travel bargains right now,https://www.smh.com.au/traveller/reviews-and-advice/the-world-s-50-greatest-travel-bargains-right-now-20240610-p5jkm5.html,8
SMH,2024_06_15_00,Jelena Dokic has lost 20 kilos. If only she could shed the trolls,https://www.smh.com.au/lifestyle/health-and-wellness/jelena-dokic-has-lost-20-kilos-if-only-she-could-shed-the-trolls-20240613-p5jlgn.html,9
ABC,2024_06_15_00,"Ashton Jones died while attempting to break into his neighbour's home, his killer has been sentenced",https://www.abc.net.au/news/2024-06-14/tas-caleb-adams-sentence-for-stabbing-home-intruder/103926762,1
ABC,2024_06_15_00,Teen news anchor says popular news service would've never started under kids' social media ban,https://www.abc.net.au/news/2024-06-14/leonardo-puglisi-slams-bi-partisan-under-16-social-media-ban/103978462,2
ABC,2024_06_15_00,"Man who raped 12yo girl on Adelaide train can't or won't control sexual instincts, prosecutors argue",https://www.abc.net.au/news/2024-06-14/train-child-rapist-dylan-lloyd-has-case-sent-to-supreme-court/103980176,3
ABC,2024_06_15_00,Famous TV psychic John Edward blasts Donald Trump,https://www.abc.net.au/news/2024-06-14/-i-won-t-even-talk-to-him-dead-john-edward-donald-trump/103980014,4
ABC,2024_06_15_00,"'One narrow path to unanimous' guilty verdicts in Greg Lynn trial, jurors told",https://www.abc.net.au/news/2024-06-14/greg-lynn-murder-trial-carol-clay-russell-hill/103978888,5
The Guardian,2024_06_15_00,Australia’s south-east to endure more wintry weather after Melbourne records coldest day in five years,https://www.theguardian.com/australia-news/article/2024/jun/14/melbourne-records-coldest-day-in-five-years-as-wintry-weather-blankets-australias-south-east,1
The Guardian,2024_06_15_00,‘My face is leaking’: taste testing the spicy ramen deemed too dangerous for Denmark,https://www.theguardian.com/food/article/2024/jun/14/my-face-is-leaking-taste-testing-the-spicy-ramen-deemed-too-dangerous-for-denmark,2
The Guardian,2024_06_15_00,Dozens of hikers report illness on trips to waterfalls by Arizona’s Grand Canyon,https://www.theguardian.com/us-news/article/2024/jun/14/grand-canyon-havasupai-waterfalls-hikers-illness,3
The Guardian,2024_06_15_00,"Live
Middle East live: Hamas official says nobody knows how many of the remaining hostages are alive",https://www.theguardian.com/world/live/2024/jun/14/middle-east-crisis-israel-gaza-war-hostages-hezbollah-lebanon-ceasefire,4
The Guardian,2024_06_15_00,Cold enthusiasts and dampness stans it is your time to shine. Here are some handy tips for surviving winter,https://www.theguardian.com/commentisfree/picture/2024/jun/14/cold-enthusiasts-and-dampness-stans-it-is-your-time-to-shine-here-are-some-handy-tips-for-surviving-winter,5
The Guardian,2024_06_15_00,Crowded House review – raucous spun-sugar pop perfection,https://www.theguardian.com/music/article/2024/jun/14/crowded-house-review-shepherds-bush-empire-london,6
The Guardian,2024_06_15_00,Trump lawyers turn focus to classified documents case after New York verdict,https://www.theguardian.com/us-news/article/2024/jun/14/trump-classified-documents-case,7
The Guardian,2024_06_15_00,Eddie Redmayne says Warren Beatty offered to bail him out after email hack,https://www.theguardian.com/film/article/2024/jun/14/eddie-redmayne-says-warren-beatty-email-hack-jamie-dornan,8
The Guardian,2024_06_15_00,Experience: I sang at Madonna’s wedding,https://www.theguardian.com/lifeandstyle/article/2024/jun/14/experience-i-sang-at-madonnas-wedding,9
The Guardian,2024_06_15_00,US and South Korea sound warning amid reports Putin is headed to North Korea,https://www.theguardian.com/world/article/2024/jun/14/vladimir-putin-north-korea-visit-us-south-korea-ukraine-war-weapons,10
The Age,2024_06_15_00,Teachers told to ignore Victoria’s phonics push as union lashes deputy premier,https://www.theage.com.au/national/victoria/teachers-told-to-ignore-government-s-phonics-push-as-union-lashes-deputy-premier-20240614-p5jlvh.html,1
The Age,2024_06_15_00,Man from family linked to the AFL charged with rapes,https://www.theage.com.au/national/victoria/man-from-family-linked-to-the-afl-charged-with-rapes-20240614-p5jlwv.html,2
The Age,2024_06_15_00,"It seemed a simple kiss on TV after the game, but it crossed a boundary",https://www.theage.com.au/lifestyle/life-and-relationships/it-seemed-a-simple-kiss-on-tv-after-the-game-but-it-crossed-a-boundary-20240613-p5jlkv.html,3
The Age,2024_06_15_00,Simpson swam fast enough to make Australia’s Olympic team. He was in the wrong race,https://www.theage.com.au/sport/swimming/simpson-swam-fast-enough-to-make-australia-s-olympic-team-he-was-in-the-wrong-race-20240613-p5jlp6.html,4
The Age,2024_06_15_00,Millie thought she was safe getting an Uber home. Her driver was a predatory impostor,https://www.theage.com.au/national/victoria/millie-thought-she-was-safe-getting-an-uber-home-her-driver-was-a-predatory-impostor-20240613-p5jljw.html,5
The Age,2024_06_15_00,Disabled teen’s family face deportation while criminals allowed to stay,https://www.theage.com.au/politics/federal/this-mother-wants-to-know-why-the-reasons-criminals-used-to-stay-in-australia-were-not-good-enough-for-her-20240612-p5jlah.html,6
The Age,2024_06_15_00,The world’s 50 greatest travel bargains right now,https://www.theage.com.au/traveller/reviews-and-advice/the-world-s-50-greatest-travel-bargains-right-now-20240610-p5jkm5.html,7
The Age,2024_06_15_00,‘Competing with Andrew Tate’: Principal urges parents to teach respect to their kids,https://www.theage.com.au/national/victoria/competing-with-andrew-tate-principal-urges-parents-to-teach-respect-to-their-kids-20240613-p5jlgc.html,8
The Age,2024_06_15_00,Jelena Dokic has lost 20 kilos. If only she could shed the trolls,https://www.theage.com.au/lifestyle/health-and-wellness/jelena-dokic-has-lost-20-kilos-if-only-she-could-shed-the-trolls-20240613-p5jlgn.html,9
Brisbane Times,2024_06_15_00,"As it happened: Brisbane on Friday, June 14",https://www.brisbanetimes.com.au/national/queensland/brisbane-news-live-brisbane-toll-tunnel-could-cost-10b-wonder-hammer-try-boosts-dolphins-latest-bt-quiz-20240613-p5jlk8.html,1
Brisbane Times,2024_06_15_00,"It seemed a simple kiss on TV after the game, but it crossed a boundary",https://www.brisbanetimes.com.au/lifestyle/life-and-relationships/it-seemed-a-simple-kiss-on-tv-after-the-game-but-it-crossed-a-boundary-20240613-p5jlkv.html,2
Brisbane Times,2024_06_15_00,Simpson swam fast enough to make Australia’s Olympic team. He was in the wrong race,https://www.brisbanetimes.com.au/sport/swimming/simpson-swam-fast-enough-to-make-australia-s-olympic-team-he-was-in-the-wrong-race-20240613-p5jlp6.html,3
Brisbane Times,2024_06_15_00,‘Be dominant’: Message to Broncos phenom before announcing NRL case,https://www.brisbanetimes.com.au/sport/nrl/be-dominant-message-to-broncos-phenom-before-announcing-nrl-case-20240611-p5jl0w.html,4
Brisbane Times,2024_06_15_00,Document reveals Brisbane toll tunnel could cost $10 billion to build,https://www.brisbanetimes.com.au/national/queensland/document-reveals-brisbane-toll-tunnel-could-cost-10-billion-to-build-20240613-p5jllp.html,5
Brisbane Times,2024_06_15_00,Jelena Dokic has lost 20 kilos. If only she could shed the trolls,https://www.brisbanetimes.com.au/lifestyle/health-and-wellness/jelena-dokic-has-lost-20-kilos-if-only-she-could-shed-the-trolls-20240613-p5jlgn.html,6
Brisbane Times,2024_06_15_00,Housing and dumped hydro details in LNP’s election-focused budget reply,https://www.brisbanetimes.com.au/politics/queensland/housing-and-dumped-hydro-details-in-lnp-s-election-focused-budget-reply-20240613-p5jleu.html,7
Brisbane Times,2024_06_15_00,Brisbane was poised to host multiple Taylor Swift Eras shows. Then there was trouble in Japan,https://www.brisbanetimes.com.au/national/queensland/brisbane-was-poised-to-host-multiple-taylor-swift-eras-shows-then-there-was-trouble-in-japan-20240613-p5jlgj.html,8
Brisbane Times,2024_06_15_00,‘My intention is to keep both of them’: Broncos’ fight to retain star pair,https://www.brisbanetimes.com.au/sport/nrl/my-intention-is-to-keep-both-of-them-broncos-fight-to-retain-star-pair-20240613-p5jlgt.html,9
ABC News,2024_06_15_00,6 News anchor Leonardo Puglisi slams bi-partisan under 16 social media ban - ABC News,https://news.google.com/rss/articles/CBMibWh0dHBzOi8vd3d3LmFiYy5uZXQuYXUvbmV3cy8yMDI0LTA2LTE0L2xlb25hcmRvLXB1Z2xpc2ktc2xhbXMtYmktcGFydGlzYW4tdW5kZXItMTYtc29jaWFsLW1lZGlhLWJhbi8xMDM5Nzg0NjLSAShodHRwczovL2FtcC5hYmMubmV0LmF1L2FydGljbGUvMTAzOTc4NDYy?oc=5&hl=en-US&gl=US&ceid=US:en,1
Sky News Australia,2024_06_15_00,‘I just did’: PM snaps at media amid grilling over John Setka’s AFL threats - Sky News Australia,https://news.google.com/rss/articles/CBMi1AFodHRwczovL3d3dy5za3luZXdzLmNvbS5hdS9hdXN0cmFsaWEtbmV3cy9wb2xpdGljcy9maXJlZHVwLWFudGhvbnktYWxiYW5lc2Utc25hcHMtYmFjay1hdC1yZXBvcnRlcnMtYWZ0ZXItaW50ZW5zZS1xdWVzdGlvbmluZy1vdmVyLWNmbWV1cy1qb2huLXNldGthcy10aHJlYXRzLXRvLXRoZS1hZmwvbmV3cy1zdG9yeS9mNzA5MWYwYTM0ZDA5OGRhYTJiOWI1ZmY1NTg0M2QxMNIB2AFodHRwczovL3d3dy5za3luZXdzLmNvbS5hdS9hdXN0cmFsaWEtbmV3cy9wb2xpdGljcy9maXJlZHVwLWFudGhvbnktYWxiYW5lc2Utc25hcHMtYmFjay1hdC1yZXBvcnRlcnMtYWZ0ZXItaW50ZW5zZS1xdWVzdGlvbmluZy1vdmVyLWNmbWV1cy1qb2huLXNldGthcy10aHJlYXRzLXRvLXRoZS1hZmwvbmV3cy1zdG9yeS9mNzA5MWYwYTM0ZDA5OGRhYTJiOWI1ZmY1NTg0M2QxMD9hbXA?oc=5&hl=en-US&gl=US&ceid=US:en,2
9News,2024_06_15_00,AEC to abolish North Sydney seat at next election in major blow to independents - 9News,https://news.google.com/rss/articles/CBMiggFodHRwczovL3d3dy45bmV3cy5jb20uYXUvbmF0aW9uYWwvbm9ydGgtc3lkbmV5LWVsZWN0b3JhdGUtYWJvbGlzaGVkLWFlYy0yMDI0LWZlZGVyYWwtZWxlY3Rpb24vYjZhMWIyNTQtNWQ1ZC00ZGEzLWE0YWMtMjBlZjU2MTZjMzJk0gEA?oc=5&hl=en-US&gl=US&ceid=US:en,3
The Age,2024_06_15_00,Teachers told to ignore Victoria’s phonics push as union lashes deputy premier - The Age,https://news.google.com/rss/articles/CBMikQFodHRwczovL3d3dy50aGVhZ2UuY29tLmF1L25hdGlvbmFsL3ZpY3RvcmlhL3RlYWNoZXJzLXRvbGQtdG8taWdub3JlLWdvdmVybm1lbnQtcy1waG9uaWNzLXB1c2gtYXMtdW5pb24tbGFzaGVzLWRlcHV0eS1wcmVtaWVyLTIwMjQwNjE0LXA1amx2aC5odG1s0gGRAWh0dHBzOi8vYW1wLnRoZWFnZS5jb20uYXUvbmF0aW9uYWwvdmljdG9yaWEvdGVhY2hlcnMtdG9sZC10by1pZ25vcmUtZ292ZXJubWVudC1zLXBob25pY3MtcHVzaC1hcy11bmlvbi1sYXNoZXMtZGVwdXR5LXByZW1pZXItMjAyNDA2MTQtcDVqbHZoLmh0bWw?oc=5&hl=en-US&gl=US&ceid=US:en,4
ABC News,2024_06_15_00,Victorian hospital meeting leak confirms plans to slash funding for small rural hospitals - ABC News,https://news.google.com/rss/articles/CBMicWh0dHBzOi8vd3d3LmFiYy5uZXQuYXUvbmV3cy8yMDI0LTA2LTE0L3JlZ2lvbmFsLWhvc3BpdGFsLWJ1ZGdldC1jdXRzLWhlYWx0aGNhcmUtZ292ZXJubWVudC1jbGF3YmFjay12aWMvMTAzOTc0OTgy0gEoaHR0cHM6Ly9hbXAuYWJjLm5ldC5hdS9hcnRpY2xlLzEwMzk3NDk4Mg?oc=5&hl=en-US&gl=US&ceid=US:en,5
9News,2024_06_15_00,Member of prominent AFL family charged with rape - 9News,https://news.google.com/rss/articles/CBMid2h0dHBzOi8vd3d3LjluZXdzLmNvbS5hdS9uYXRpb25hbC9tZW1iZXItb2YtcHJvbWluZW50LWFmbC1mYW1pbHktY2hhcmdlZC13aXRoLXJhcGUvY2JlZjMyNTgtODBhYi00NjViLThhNjUtNzc2MmM4NzFjOTNm0gFFaHR0cHM6Ly9hbXAuOW5ld3MuY29tLmF1L2FydGljbGUvY2JlZjMyNTgtODBhYi00NjViLThhNjUtNzc2MmM4NzFjOTNm?oc=5&hl=en-US&gl=US&ceid=US:en,6
ABC News,2024_06_15_00,"Elective surgeries resume, but some procedures still on hold while code yellow emergency remains - ABC News",https://news.google.com/rss/articles/CBMib2h0dHBzOi8vd3d3LmFiYy5uZXQuYXUvbmV3cy8yMDI0LTA2LTE0L2VsZWN0aXZlLXN1cmdlcmllcy1yZXN1bWUtYW1pZC1vbmdvaW5nLXNhLWhvc3BpdGFsLWNvZGUteWVsbG93LzEwMzk4MDIxMtIBKGh0dHBzOi8vYW1wLmFiYy5uZXQuYXUvYXJ0aWNsZS8xMDM5ODAyMTI?oc=5&hl=en-US&gl=US&ceid=US:en,7
9News,2024_06_15_00,Queensland mother searches for answers after daughter dies in hospital despite Ryan's Rule intervention - 9News,https://news.google.com/rss/articles/CBMilgFodHRwczovL3d3dy45bmV3cy5jb20uYXUvbmF0aW9uYWwvc2VhcmNoLWZvci1hbnN3ZXJzLWFmdGVyLWNoaWxkLWRpZXMtaW4taG9zcGl0YWwtZGVzcGl0ZS1yeWFucy1ydWxlLWludGVydmVudGlvbi9kOGEwMTZhMC0wY2UzLTQwNzMtOTRkYy05MmRkZTU3MDU5Y2bSAUVodHRwczovL2FtcC45bmV3cy5jb20uYXUvYXJ0aWNsZS9kOGEwMTZhMC0wY2UzLTQwNzMtOTRkYy05MmRkZTU3MDU5Y2Y?oc=5&hl=en-US&gl=US&ceid=US:en,8
Sydney Morning Herald,2024_06_15_00,Sydney University orders protest camp to leave - Sydney Morning Herald,https://news.google.com/rss/articles/CBMiZ2h0dHBzOi8vd3d3LnNtaC5jb20uYXUvbmF0aW9uYWwvbnN3L3N5ZG5leS11bml2ZXJzaXR5LW9yZGVycy1wcm90ZXN0LWNhbXAtdG8tbGVhdmUtMjAyNDA2MTQtcDVqbHZ5Lmh0bWzSAWdodHRwczovL2FtcC5zbWguY29tLmF1L25hdGlvbmFsL25zdy9zeWRuZXktdW5pdmVyc2l0eS1vcmRlcnMtcHJvdGVzdC1jYW1wLXRvLWxlYXZlLTIwMjQwNjE0LXA1amx2eS5odG1s?oc=5&hl=en-US&gl=US&ceid=US:en,9
9News,2024_06_15_00,Perth man charged with manslaughter of 11-year-old boy - 9News,https://news.google.com/rss/articles/CBMieWh0dHBzOi8vd3d3LjluZXdzLmNvbS5hdS9uYXRpb25hbC9wZXJ0aC1tYW4tY2hhcmdlZC13aXRoLW1hbnNsYXVnaHRlci1vZi0xMS15ZWFyLW9sZC9iN2IyOGNmOC0wYzE4LTQyN2UtYTQ0Ny1lNWJjZjM5MzUyNGLSAUVodHRwczovL2FtcC45bmV3cy5jb20uYXUvYXJ0aWNsZS9iN2IyOGNmOC0wYzE4LTQyN2UtYTQ0Ny1lNWJjZjM5MzUyNGI?oc=5&hl=en-US&gl=US&ceid=US:en,10
ABC News,2024_06_15_00,Chinese #MeToo journalist Sophia Huang Xueqin and labour activist Wang Jianbing jailed - ABC News,https://news.google.com/rss/articles/CBMibmh0dHBzOi8vd3d3LmFiYy5uZXQuYXUvbmV3cy8yMDI0LTA2LTE0L2NoaW5lc2UtbWUtdG9vLWpvdXJuYWxpc3Qtc29waGlhLWh1YW5nLXh1ZXFpbi1qYWlsZWQtaW4tY2hpbmEvMTAzOTgxNjY40gEoaHR0cHM6Ly9hbXAuYWJjLm5ldC5hdS9hcnRpY2xlLzEwMzk4MTY2OA?oc=5&hl=en-US&gl=US&ceid=US:en,11
9News,2024_06_15_00,Putin vows truce if Ukraine exits Moscow-occupied areas and drops NATO bid - a nonstarter for Kyiv - 9News,https://news.google.com/rss/articles/CBMipAFodHRwczovL3d3dy45bmV3cy5jb20uYXUvd29ybGQvcHV0aW4tdm93cy10cnVjZS1pZi11a3JhaW5lLWV4aXRzLW1vc2Nvd29jY3VwaWVkLWFyZWFzLWFuZC1kcm9wcy1uYXRvLWJpZC0tYS1ub25zdGFydGVyLWZvci1reWl2L2VlZTU2MWYxLTc3YWQtNDJhZi04OGNhLTIzMzRmMWM4OWJmMNIBRWh0dHBzOi8vYW1wLjluZXdzLmNvbS5hdS9hcnRpY2xlL2VlZTU2MWYxLTc3YWQtNDJhZi04OGNhLTIzMzRmMWM4OWJmMA?oc=5&hl=en-US&gl=US&ceid=US:en,12
Sydney Morning Herald,2024_06_15_00,"Zelensky just signed a ‘historic’ deal. However, the next 48 hours will be crucial for Ukraine - Sydney Morning Herald",https://news.google.com/rss/articles/CBMikwFodHRwczovL3d3dy5zbWguY29tLmF1L3dvcmxkL2V1cm9wZS96ZWxlbnNreS1qdXN0LXNpZ25lZC1hLWhpc3RvcmljLWRlYWwtaG93ZXZlci10aGUtbmV4dC00OC1ob3Vycy13aWxsLWJlLWNydWNpYWwtZm9yLXVrcmFpbmUtMjAyNDA2MTQtcDVqbHMxLmh0bWzSAZMBaHR0cHM6Ly9hbXAuc21oLmNvbS5hdS93b3JsZC9ldXJvcGUvemVsZW5za3ktanVzdC1zaWduZWQtYS1oaXN0b3JpYy1kZWFsLWhvd2V2ZXItdGhlLW5leHQtNDgtaG91cnMtd2lsbC1iZS1jcnVjaWFsLWZvci11a3JhaW5lLTIwMjQwNjE0LXA1amxzMS5odG1s?oc=5&hl=en-US&gl=US&ceid=US:en,13
Hindustan Times,2024_06_15_00,Putin’s UN Envoy Slams U.S. & UK Over Red Sea Tensions; ‘Attacks On Yemen Leave A Stain Of Blood…’ - Hindustan Times,https://news.google.com/rss/articles/CCAiC2ZPZzl4VXBGQXRjmAEB?oc=5&hl=en-US&gl=US&ceid=US:en,14
The Australian Financial Review,2024_06_15_00,"ASX 200 LIVE: ASX to fall, Nasdaq and S&P 500 extend advances - The Australian Financial Review",https://news.google.com/rss/articles/CBMiamh0dHBzOi8vd3d3LmFmci5jb20vbWFya2V0cy9lcXVpdHktbWFya2V0cy9hc3gtdG8tZmFsbC10ZWNocy1wb3dlci1zLWFuZC1wLTUwMC1ldmVyLWhpZ2hlci0yMDI0MDYxNC1wNWpscG7SAQA?oc=5&hl=en-US&gl=US&ceid=US:en,15
ABC News (Australia),2024_06_15_00,Elon Musk’s big payday courtesy of Tesla's shareholders | Finance Report | ABC News - ABC News (Australia),https://news.google.com/rss/articles/CCAiC0tfaDN4bE1CSWdzmAEB?oc=5&hl=en-US&gl=US&ceid=US:en,16
Sydney Morning Herald,2024_06_15_00,Telstra ditches carbon credits to push harder on direct emissions - Sydney Morning Herald,https://news.google.com/rss/articles/CBMieGh0dHBzOi8vd3d3LnNtaC5jb20uYXUvdGVjaG5vbG9neS90ZWxzdHJhLWRpdGNoZXMtY2FyYm9uLWNyZWRpdHMtdG8tcHVzaC1oYXJkZXItb24tZGlyZWN0LWVtaXNzaW9ucy0yMDI0MDYxMy1wNWpsa2EuaHRtbNIBeGh0dHBzOi8vYW1wLnNtaC5jb20uYXUvdGVjaG5vbG9neS90ZWxzdHJhLWRpdGNoZXMtY2FyYm9uLWNyZWRpdHMtdG8tcHVzaC1oYXJkZXItb24tZGlyZWN0LWVtaXNzaW9ucy0yMDI0MDYxMy1wNWpsa2EuaHRtbA?oc=5&hl=en-US&gl=US&ceid=US:en,17
9 News Australia,2024_06_15_00,Australia's unemployment rate falls | 9 News Australia - 9 News Australia,https://news.google.com/rss/articles/CCAiC3c2alB0ZlpNR0VBmAEB?oc=5&hl=en-US&gl=US&ceid=US:en,18
Forbes,2024_06_15_00,"Apple Debuts Intelligence, Mistral Raises $600 Million, New AI Text-To-Video - Forbes",https://news.google.com/rss/articles/CBMifmh0dHBzOi8vd3d3LmZvcmJlcy5jb20vc2l0ZXMvY2hhcmxpZWZpbmsvMjAyNC8wNi8xMy9hcHBsZS1kZWJ1dHMtaW50ZWxsaWdlbmNlLW1pc3RyYWwtcmFpc2VzLTYwMC1taWxsaW9uLW5ldy1haS10ZXh0LXRvLXZpZGVvL9IBAA?oc=5&hl=en-US&gl=US&ceid=US:en,19
News-Medical.Net,2024_06_15_00,Key Insights into Biological Safety Cabinets - News-Medical.Net,https://news.google.com/rss/articles/CBMiXGh0dHBzOi8vd3d3Lm5ld3MtbWVkaWNhbC5uZXQvbmV3cy8yMDI0MDYxNC9LZXktSW5zaWdodHMtaW50by1CaW9sb2dpY2FsLVNhZmV0eS1DYWJpbmV0cy5hc3B40gEA?oc=5&hl=en-US&gl=US&ceid=US:en,20
ZDNet,2024_06_15_00,Apple CarPlay is getting an upgrade - here are the coolest features announced at WWDC 2024 - ZDNet,https://news.google.com/rss/articles/CBMid2h0dHBzOi8vd3d3LnpkbmV0LmNvbS9hcnRpY2xlL2FwcGxlLWNhcnBsYXktaXMtZ2V0dGluZy1hbi11cGdyYWRlLWhlcmUtYXJlLXRoZS1jb29sZXN0LWZlYXR1cmVzLWFubm91bmNlZC1hdC13d2RjLTIwMjQv0gEA?oc=5&hl=en-US&gl=US&ceid=US:en,21
ABC News,2024_06_15_00,"Weekly news quiz: New life for punk legends, a race walking upset, and Apple gets in the AI game - ABC News",https://news.google.com/rss/articles/CBMiSWh0dHBzOi8vd3d3LmFiYy5uZXQuYXUvbmV3cy8yMDI0LTA2LTE0L3dlZWtseS1uZXdzLXF1aXotanVuZS0xNC8xMDM5NzQwMTjSAQA?oc=5&hl=en-US&gl=US&ceid=US:en,22
news.com.au,2024_06_15_00,Beckham addresses huge Spice Girls rumour - news.com.au,https://news.google.com/rss/articles/CBMikAFodHRwczovL3d3dy5uZXdzLmNvbS5hdS9lbnRlcnRhaW5tZW50L2NlbGVicml0eS1saWZlL2RhdmlkLWJlY2toYW0tYWRkcmVzc2VzLWh1Z2Utc3BpY2UtZ2lybHMtcnVtb3VyL25ld3Mtc3RvcnkvZmNlYzE4NDJjNGRkODNkYzE2ZjE0NWY0YmViYjEyNmXSAZQBaHR0cHM6Ly93d3cubmV3cy5jb20uYXUvZW50ZXJ0YWlubWVudC9jZWxlYnJpdHktbGlmZS9kYXZpZC1iZWNraGFtLWFkZHJlc3Nlcy1odWdlLXNwaWNlLWdpcmxzLXJ1bW91ci9uZXdzLXN0b3J5L2ZjZWMxODQyYzRkZDgzZGMxNmYxNDVmNGJlYmIxMjZlP2FtcA?oc=5&hl=en-US&gl=US&ceid=US:en,23
9News,2024_06_15_00,Australia's oldest working artist and former Archibald winner Guy Warren dies aged 103 - 9News,https://news.google.com/rss/articles/CBMib2h0dHBzOi8vd3d3LjluZXdzLmNvbS5hdS9uYXRpb25hbC9hcmNoaWJhbGQtd2lubmVyLWd1eS13YXJyZW4tZGllcy1hZ2UtMTAzL2E0ZGM5MzhjLWQxMWUtNGY5YS1iNzQwLWM1MTIwNmYyM2ExMdIBRWh0dHBzOi8vYW1wLjluZXdzLmNvbS5hdS9hcnRpY2xlL2E0ZGM5MzhjLWQxMWUtNGY5YS1iNzQwLWM1MTIwNmYyM2ExMQ?oc=5&hl=en-US&gl=US&ceid=US:en,24
NME,2024_06_15_00,'The Boys' season four episode three ending explained: where does the red door lead? - NME,https://news.google.com/rss/articles/CBMiUGh0dHBzOi8vd3d3Lm5tZS5jb20vbmV3cy90di90aGUtYm95cy1zZWFzb24tNC1lcGlzb2RlLTMtZW5kaW5nLWV4cGxhaW5lZC0zNzY0NDM30gEA?oc=5&hl=en-US&gl=US&ceid=US:en,25
news.com.au,2024_06_15_00,Tom Brady ‘stress’ ends Gisele’s romance - news.com.au,https://news.google.com/rss/articles/CBMiyAFodHRwczovL3d3dy5uZXdzLmNvbS5hdS9lbnRlcnRhaW5tZW50L2NlbGVicml0eS1saWZlL2hvb2stdXBzLWJyZWFrLXVwcy9naXNlbGUtYm5kY2hlbi1hbmQtam9hcXVpbS12YWxlbnRlLXJlcG9ydGVkbHktc3BsaXQtb3Zlci1zdHJlc3MtZnJvbS10b20tYnJhZHktcm9hc3QvbmV3cy1zdG9yeS84MzUyNTRmODE0YTgyNTU1NWE5NGM2MTFjMTExMWE4OdIBAA?oc=5&hl=en-US&gl=US&ceid=US:en,26
Sydney Morning Herald,2024_06_15_00,Mitchell makes irresistible Origin statement as Rabbitohs revival gathers pace - Sydney Morning Herald,https://news.google.com/rss/articles/CBMiggFodHRwczovL3d3dy5zbWguY29tLmF1L3Nwb3J0L25ybC9ucmwtcm91bmQtMTUtbGl2ZS1zb3V0aC1zeWRuZXktcmFiYml0b2hzLXYtYnJpc2JhbmUtYnJvbmNvcy1hdC1hY2Nvci1zdGFkaXVtLTIwMjQwNjE0LXA1amx1aS5odG1s0gGCAWh0dHBzOi8vYW1wLnNtaC5jb20uYXUvc3BvcnQvbnJsL25ybC1yb3VuZC0xNS1saXZlLXNvdXRoLXN5ZG5leS1yYWJiaXRvaHMtdi1icmlzYmFuZS1icm9uY29zLWF0LWFjY29yLXN0YWRpdW0tMjAyNDA2MTQtcDVqbHVpLmh0bWw?oc=5&hl=en-US&gl=US&ceid=US:en,27
Nine,2024_06_15_00,'What just happened?': Blues book Super Rugby Pacific final berth in barnstorming win over Brumbies - Nine,https://news.google.com/rss/articles/CBMihgFodHRwczovL3d3dy5uaW5lLmNvbS5hdS9zcG9ydC9ydWdieS9zdXBlci1wYWNpZmljLW5ld3MtMjAyNC1ibHVlcy12cy1icnVtYmllcy1zZW1pLWZpbmFsLXJlc3VsdHMtaGlnaGxpZ2h0cy12aWRlby0yMDI0MDYxNC1wNWpseTEuaHRtbNIBRGh0dHBzOi8vYW1wLm5pbmUuY29tLmF1L2FydGljbGUvMGYzYzI1OWUtODFjMi00ZWRiLWEyNGMtOTNkZmQzYzY5YTdh?oc=5&hl=en-US&gl=US&ceid=US:en,28
Nine,2024_06_15_00,The five young players to watch at the 2024 European Championships - Nine,https://news.google.com/rss/articles/CBMicWh0dHBzOi8vd3d3Lm5pbmUuY29tLmF1L3Nwb3J0L2Zvb3RiYWxsL25ld3MtMjAyNC1ldXJvcGVhbi1jaGFtcGlvbnNoaXBzLXlvdW5nLXN0YXJzLXRvLXdhdGNoLTIwMjQwNjE0LXA1amx2Zy5odG1s0gFEaHR0cHM6Ly9hbXAubmluZS5jb20uYXUvYXJ0aWNsZS85OGY5YjljMi01MDM3LTQ5ZDUtOWUwNC1hNDlhNzRkYTc2ZTc?oc=5&hl=en-US&gl=US&ceid=US:en,29
Sydney Morning Herald,2024_06_15_00,"McKeon, Campbell bomb in 100m freestyle as O'Callaghan seals win in stacked final - Sydney Morning Herald",https://news.google.com/rss/articles/CBMid2h0dHBzOi8vd3d3LnNtaC5jb20uYXUvc3BvcnQvc3dpbW1pbmcvd2h5LTAtMDEtb2YtYS1zZWNvbmQtbWF5LXdyZWNrLWNhdGUtY2FtcGJlbGwtcy1vbHltcGljLWhvcGVzLTIwMjQwNjE0LXA1amx1YS5odG1s0gEA?oc=5&hl=en-US&gl=US&ceid=US:en,30
Mirage News,2024_06_15_00,NASA's Perseverance Crosses Old River to Hit Science Goal - Mirage News,https://news.google.com/rss/articles/CBMiT2h0dHBzOi8vd3d3Lm1pcmFnZW5ld3MuY29tL25hc2FzLXBlcnNldmVyYW5jZS1jcm9zc2VzLW9sZC1yaXZlci10by1oaXQtMTI1NTYzMi_SAQA?oc=5&hl=en-US&gl=US&ceid=US:en,31
Mirage News,2024_06_15_00,Lab Now Able to Generate Pair Plasmas from Deep Space - Mirage News,https://news.google.com/rss/articles/CBMiU2h0dHBzOi8vd3d3Lm1pcmFnZW5ld3MuY29tL2xhYi1ub3ctYWJsZS10by1nZW5lcmF0ZS1wYWlyLXBsYXNtYXMtZnJvbS1kZWVwLTEyNTU3MzAv0gEA?oc=5&hl=en-US&gl=US&ceid=US:en,32
9News,2024_06_15_00,"Astronaut's distress call from International Space Station a mistake, NASA says - 9News",https://news.google.com/rss/articles/CBMikQFodHRwczovL3d3dy45bmV3cy5jb20uYXUvd29ybGQvbmFzYS1zYXlzLWFzdHJvbmF1dHMtZGlzdHJlc3MtY2FsbC1mcm9tLWludGVybmF0aW9uYWwtc3BhY2Utc3RhdGlvbi1hLW1pc3Rha2UvYTYzN2NkMDItZGY0OS00OTJhLWI0OWEtMWQ2YjhjOGVkNTNl0gFFaHR0cHM6Ly9hbXAuOW5ld3MuY29tLmF1L2FydGljbGUvYTYzN2NkMDItZGY0OS00OTJhLWI0OWEtMWQ2YjhjOGVkNTNl?oc=5&hl=en-US&gl=US&ceid=US:en,33
9News,2024_06_15_00,The animal astronauts who paved the way for humans in space - 9News,https://news.google.com/rss/articles/CBMicWh0dHBzOi8vd3d3LjluZXdzLmNvbS5hdS93b3JsZC9hbmltYWxzLWluLXNwYWNlLXBpb25lZXItbm9uLWh1bWFuLWFzdHJvbmF1dHMvZWQ4ODQ4ZDYtMzgzZS00YmY4LTk1OWEtZWVkNmM5ZTZmMWU50gEA?oc=5&hl=en-US&gl=US&ceid=US:en,34
The Conversation,2024_06_15_00,Results are looking promising for a combined COVID and flu vaccine. Here's how it could benefit public health - The Conversation,https://news.google.com/rss/articles/CBMijgFodHRwczovL3RoZWNvbnZlcnNhdGlvbi5jb20vcmVzdWx0cy1hcmUtbG9va2luZy1wcm9taXNpbmctZm9yLWEtY29tYmluZWQtY292aWQtYW5kLWZsdS12YWNjaW5lLWhlcmVzLWhvdy1pdC1jb3VsZC1iZW5lZml0LXB1YmxpYy1oZWFsdGgtMjMyMjc40gEA?oc=5&hl=en-US&gl=US&ceid=US:en,35
Weill Cornell Medicine Newsroom,2024_06_15_00,Ultrasensitive Liquid Biopsy Tech Spots Cancer Earlier than Standard Methods - Weill Cornell Medicine Newsroom,https://news.google.com/rss/articles/CBMieGh0dHBzOi8vbmV3cy53ZWlsbC5jb3JuZWxsLmVkdS9uZXdzLzIwMjQvMDYvdWx0cmFzZW5zaXRpdmUtbGlxdWlkLWJpb3BzeS10ZWNoLXNwb3RzLWNhbmNlci1lYXJsaWVyLXRoYW4tc3RhbmRhcmQtbWV0aG9kc9IBAA?oc=5&hl=en-US&gl=US&ceid=US:en,36
Mirage News,2024_06_15_00,Mouse Study Reveals Approach to Prevent Spinal Cord Injury Complications - Mirage News,https://news.google.com/rss/articles/CBMiUmh0dHBzOi8vd3d3Lm1pcmFnZW5ld3MuY29tL21vdXNlLXN0dWR5LXJldmVhbHMtYXBwcm9hY2gtdG8tcHJldmVudC1zcGluYWwtMTI1NTQ1Ny_SAQA?oc=5&hl=en-US&gl=US&ceid=US:en,37
9News,2024_06_15_00,Bird flu cases rise as authorities quell food safety concerns - 9News,https://news.google.com/rss/articles/CBMihAFodHRwczovL3d3dy45bmV3cy5jb20uYXUvbmF0aW9uYWwvYmlyZC1mbHUtY2FzZXMtcmlzZS1hcy1hdXRob3JpdGllcy1xdWVsbC1mb29kLXNhZmV0eS1jb25jZXJucy84ODNhNGQ1Ny04YjM5LTRhYmQtYjBhYi1iZDgxMGY3ZTEwOTnSAUVodHRwczovL2FtcC45bmV3cy5jb20uYXUvYXJ0aWNsZS84ODNhNGQ1Ny04YjM5LTRhYmQtYjBhYi1iZDgxMGY3ZTEwOTk?oc=5&hl=en-US&gl=US&ceid=US:en,38
