publication,scraped_datetime,Headline,Url,Rank
International Atomic Energy Agency,2024_06_13_02,IAEA Head Grossi Speaks to Insurance Companies: “There is a Global Consensus that Nuclear Should be Accelerated” - International Atomic Energy Agency,https://news.google.com/rss/articles/CBMikgFodHRwczovL3d3dy5pYWVhLm9yZy9uZXdzY2VudGVyL25ld3MvaWFlYS1oZWFkLWdyb3NzaS1zcGVha3MtdG8taW5zdXJhbmNlLWNvbXBhbmllcy10aGVyZS1pcy1hLWdsb2JhbC1jb25zZW5zdXMtdGhhdC1udWNsZWFyLXNob3VsZC1iZS1hY2NlbGVyYXRlZNIBAA?oc=5&hl=en-US&gl=US&ceid=US:en,34
News-Medical.Net,2024_06_13_02,Nutrients deficiency pattern possible important risk factor for mortality in older adults with hypertension - News-Medical.Net,https://news.google.com/rss/articles/CBMimwFodHRwczovL3d3dy5uZXdzLW1lZGljYWwubmV0L25ld3MvMjAyNDA2MTIvTnV0cmllbnRzLWRlZmljaWVuY3ktcGF0dGVybi1wb3NzaWJsZS1pbXBvcnRhbnQtcmlzay1mYWN0b3ItZm9yLW1vcnRhbGl0eS1pbi1vbGRlci1hZHVsdHMtd2l0aC1oeXBlcnRlbnNpb24uYXNweNIBAA?oc=5&hl=en-US&gl=US&ceid=US:en,35
ABC News,2024_06_13_02,Travelling these school holidays? Here's when to get your COVID booster - ABC News,https://news.google.com/rss/articles/CBMiYmh0dHBzOi8vd3d3LmFiYy5uZXQuYXUvbmV3cy8yMDI0LTA2LTEyL3NjaG9vbC1ob2xpZGF5cy13aGVuLXNob3VsZC15b3UtZ2V0LWNvdmlkLWJvb3N0ZXIvMTAzOTUwMTYw0gEA?oc=5&hl=en-US&gl=US&ceid=US:en,36
Sky News Australia,2024_06_13_02,‘Genocide’: Australian chickens under siege over cases of bird flu - Sky News Australia,https://news.google.com/rss/articles/CCAiC05QcXR1MHdROG5zmAEB?oc=5&hl=en-US&gl=US&ceid=US:en,37
Yahoo News Australia,2024_06_13_02,WHO confirms rare human case of bird flu infection in India - Yahoo News Australia,https://news.google.com/rss/articles/CBMiRmh0dHBzOi8vYXUubmV3cy55YWhvby5jb20vY29uZmlybXMtcmFyZS1odW1hbi1jYXNlLWJpcmQtMDYxMzA4OTc2Lmh0bWzSAQA?oc=5&hl=en-US&gl=US&ceid=US:en,38
