publication,scraped_datetime,Headline,Url,Rank
SMH,2024_06_14_21,Cloud-seeding program over Snowy Hydro suspended,https://www.smh.com.au/national/nsw/cloud-seeding-program-over-snowy-hydro-suspended-20240613-p5jlgb.html,1
SMH,2024_06_14_21,The MP with four jobs and the multimillion-dollar property development,https://www.smh.com.au/national/nsw/the-mp-with-four-jobs-and-the-multimillion-dollar-property-development-20240613-p5jlib.html,2
SMH,2024_06_14_21,Scott Morrison denied membership of Sydney’s all-male Australian Club,https://www.smh.com.au/cbd/scott-morrison-denied-membership-of-sydney-s-all-male-australian-club-20240612-p5jlcq.html,3
SMH,2024_06_14_21,Australia news as it happened: G7 summit opens with deal to use Russian assets for Ukraine; Coalition to push for social media reform,https://www.smh.com.au/national/australia-news-live-g7-summit-opens-with-deal-to-use-russian-assets-for-ukraine-coalition-to-push-for-laws-forcing-social-media-to-check-users-ages-20240614-p5jlpq.html,4
SMH,2024_06_14_21,Independents fight for survival as Sydney’s election battlelines redrawn,https://www.smh.com.au/politics/federal/federal-seat-of-north-sydney-to-be-abolished-20240614-p5jlql.html,5
SMH,2024_06_14_21,"It seemed a simple kiss on TV after the game, but it crossed a boundary",https://www.smh.com.au/lifestyle/life-and-relationships/it-seemed-a-simple-kiss-on-tv-after-the-game-but-it-crossed-a-boundary-20240613-p5jlkv.html,6
SMH,2024_06_14_21,Simpson swam fast enough to make Australia’s Olympic team. He was in the wrong race,https://www.smh.com.au/sport/swimming/simpson-swam-fast-enough-to-make-australia-s-olympic-team-he-was-in-the-wrong-race-20240613-p5jlp6.html,7
SMH,2024_06_14_21,The world’s 50 greatest travel bargains right now,https://www.smh.com.au/traveller/reviews-and-advice/the-world-s-50-greatest-travel-bargains-right-now-20240610-p5jkm5.html,8
SMH,2024_06_14_21,Jelena Dokic has lost 20 kilos. If only she could shed the trolls,https://www.smh.com.au/lifestyle/health-and-wellness/jelena-dokic-has-lost-20-kilos-if-only-she-could-shed-the-trolls-20240613-p5jlgn.html,9
ABC,2024_06_14_21,"Ashton Jones died while attempting to break into his neighbour's home, his killer has been sentenced",https://www.abc.net.au/news/2024-06-14/tas-caleb-adams-sentence-for-stabbing-home-intruder/103926762,1
ABC,2024_06_14_21,"Man who raped 12yo girl on Adelaide train can't or won't control sexual instincts, prosecutors argue",https://www.abc.net.au/news/2024-06-14/train-child-rapist-dylan-lloyd-has-case-sent-to-supreme-court/103980176,2
ABC,2024_06_14_21,Canberra man who raped woman and wrote on her with permanent marker faces sentencing,https://www.abc.net.au/news/2024-06-14/canberra-man-rape-wrote-on-woman-faces-sentencing/103978464,3
ABC,2024_06_14_21,Teen news anchor says popular news service would've never started under kids' social media ban,https://www.abc.net.au/news/2024-06-14/leonardo-puglisi-slams-bi-partisan-under-16-social-media-ban/103978462,4
ABC,2024_06_14_21,"'One narrow path to unanimous' guilty verdicts in Greg Lynn trial, jurors told",https://www.abc.net.au/news/2024-06-14/greg-lynn-murder-trial-carol-clay-russell-hill/103978888,5
News,2024_06_14_21,Shock as cult favourite stores to close,https://www.news.com.au/finance/business/retail/cant-spend-7-on-a-donut-rising-costofliving-takes-a-bite-out-of-hipster-fad/news-story/fbfe1ae216e186cca2ad724548b8bfb2,1
News,2024_06_14_21,‘Not paying rent’: Man booted from cafe,https://www.news.com.au/lifestyle/food/eat/move-on-journalist-kicked-out-of-new-zealand-cafe-after-on-hour/news-story/9da0ae8ad69499baa22b603a68a8ae1a,2
News,2024_06_14_21,Top bank fires workers for sneaky WFH trick,https://www.news.com.au/finance/work/top-bank-fires-workers-for-sneaky-wfh-trick/news-story/edc5e9fa02b0ee2771a7f5a80ba5be4b,3
News,2024_06_14_21,Nation burns as President stokes chaos,https://www.news.com.au/finance/economy/world-economy/tried-to-perpetrate-a-coup-dtat-argentina-erupts-into-chaotic-riots-as-farright-president-javier-milei-pushed-controversial-agenda/news-story/96da74976c7446d59b8c423e12f6dd9c,4
News,2024_06_14_21,‘WTF’: Sad Kerr video rocks football world,https://www.news.com.au/sport/football/dont-do-that-again-sad-sam-kerr-chelsea-hoax-rocks-football-world/news-story/e79a6b8b30bc7b76820cb704cab483ea,5
The Guardian,2024_06_14_21,Australia’s south-east to endure more wintry weather after Melbourne records coldest day in five years,https://www.theguardian.com/australia-news/article/2024/jun/14/melbourne-records-coldest-day-in-five-years-as-wintry-weather-blankets-australias-south-east,1
The Guardian,2024_06_14_21,"Live
Middle East live: Hamas official says nobody knows how many of the remaining hostages are alive",https://www.theguardian.com/world/live/2024/jun/14/middle-east-crisis-israel-gaza-war-hostages-hezbollah-lebanon-ceasefire,2
The Guardian,2024_06_14_21,‘My face is leaking’: taste testing the spicy ramen deemed too dangerous for Denmark,https://www.theguardian.com/food/article/2024/jun/14/my-face-is-leaking-taste-testing-the-spicy-ramen-deemed-too-dangerous-for-denmark,3
The Guardian,2024_06_14_21,Dozens of hikers report illness on trips to waterfalls by Arizona’s Grand Canyon,https://www.theguardian.com/us-news/article/2024/jun/14/grand-canyon-havasupai-waterfalls-hikers-illness,4
The Guardian,2024_06_14_21,US and South Korea sound warning amid reports Putin is headed to North Korea,https://www.theguardian.com/world/article/2024/jun/14/vladimir-putin-north-korea-visit-us-south-korea-ukraine-war-weapons,5
The Guardian,2024_06_14_21,Cold enthusiasts and dampness stans it is your time to shine. Here are some handy tips for surviving winter,https://www.theguardian.com/commentisfree/picture/2024/jun/14/cold-enthusiasts-and-dampness-stans-it-is-your-time-to-shine-here-are-some-handy-tips-for-surviving-winter,6
The Guardian,2024_06_14_21,Don’t you know who I am? Why vox-poppers failing to spot celebrities is such a good thing,https://www.theguardian.com/film/article/2024/jun/13/dont-you-know-who-i-am-why-vox-poppers-failing-to-spot-celebrities-is-such-a-good-thing,7
The Guardian,2024_06_14_21,Independent MP Kylea Tink’s electorate of North Sydney to be abolished under AEC proposal,https://www.theguardian.com/australia-news/article/2024/jun/14/independent-mp-kylea-tinks-electorate-of-north-sydney-to-be-abolished-under-aec-proposal,8
The Guardian,2024_06_14_21,Police offer $1m reward to solve murder of Maria James inside Melbourne bookshop,https://www.theguardian.com/australia-news/article/2024/jun/14/maria-james-murder-victoria-police-offer-1m-reward-thornbury-melbourne-bookshop,9
The Guardian,2024_06_14_21,Ukraine war briefing: Sanctions to strike at Putin’s oil ‘shadow fleet’,https://www.theguardian.com/world/article/2024/jun/14/ukraine-war-briefing-sanctions-to-strike-at-putins-oil-shadow-fleet,10
The Age,2024_06_14_21,"It seemed a simple kiss on TV after the game, but it crossed a boundary",https://www.theage.com.au/lifestyle/life-and-relationships/it-seemed-a-simple-kiss-on-tv-after-the-game-but-it-crossed-a-boundary-20240613-p5jlkv.html,1
The Age,2024_06_14_21,Jelena Dokic has lost 20 kilos. If only she could shed the trolls,https://www.theage.com.au/lifestyle/health-and-wellness/jelena-dokic-has-lost-20-kilos-if-only-she-could-shed-the-trolls-20240613-p5jlgn.html,2
The Age,2024_06_14_21,Teachers told to ignore Victoria’s phonics push as union lashes deputy premier,https://www.theage.com.au/national/victoria/teachers-told-to-ignore-government-s-phonics-push-as-union-lashes-deputy-premier-20240614-p5jlvh.html,3
The Age,2024_06_14_21,Simpson swam fast enough to make Australia’s Olympic team. He was in the wrong race,https://www.theage.com.au/sport/swimming/simpson-swam-fast-enough-to-make-australia-s-olympic-team-he-was-in-the-wrong-race-20240613-p5jlp6.html,4
The Age,2024_06_14_21,Petracca’s season over as Melbourne great puts heat on Goodwin,https://www.theage.com.au/sport/afl/demons-superstar-christan-petracca-to-miss-the-rest-of-the-season-20240613-p5jlkq.html,5
The Age,2024_06_14_21,Millie thought she was safe getting an Uber home. Her driver was a predatory impostor,https://www.theage.com.au/national/victoria/millie-thought-she-was-safe-getting-an-uber-home-her-driver-was-a-predatory-impostor-20240613-p5jljw.html,6
The Age,2024_06_14_21,The world’s 50 greatest travel bargains right now,https://www.theage.com.au/traveller/reviews-and-advice/the-world-s-50-greatest-travel-bargains-right-now-20240610-p5jkm5.html,7
The Age,2024_06_14_21,‘Competing with Andrew Tate’: Principal urges parents to teach respect to their kids,https://www.theage.com.au/national/victoria/competing-with-andrew-tate-principal-urges-parents-to-teach-respect-to-their-kids-20240613-p5jlgc.html,8
The Age,2024_06_14_21,How an ex-Neighbours star came to host the largest Trump fundraiser outside the US,https://www.theage.com.au/world/europe/how-an-ex-neighbours-star-came-to-host-the-largest-trump-fundraiser-outside-the-us-20240613-p5jlhs.html,9
Brisbane Times,2024_06_14_21,"As it happened: Brisbane on Friday, June 14",https://www.brisbanetimes.com.au/national/queensland/brisbane-news-live-brisbane-toll-tunnel-could-cost-10b-wonder-hammer-try-boosts-dolphins-latest-bt-quiz-20240613-p5jlk8.html,1
Brisbane Times,2024_06_14_21,"It seemed a simple kiss on TV after the game, but it crossed a boundary",https://www.brisbanetimes.com.au/lifestyle/life-and-relationships/it-seemed-a-simple-kiss-on-tv-after-the-game-but-it-crossed-a-boundary-20240613-p5jlkv.html,2
Brisbane Times,2024_06_14_21,Simpson swam fast enough to make Australia’s Olympic team. He was in the wrong race,https://www.brisbanetimes.com.au/sport/swimming/simpson-swam-fast-enough-to-make-australia-s-olympic-team-he-was-in-the-wrong-race-20240613-p5jlp6.html,3
Brisbane Times,2024_06_14_21,"Boosted by Hammer’s wonder try, Dolphins beat Sharks in thriller",https://www.brisbanetimes.com.au/sport/nrl/nrl-round-15-live-cronulla-sharks-v-dolphins-at-pointsbet-stadium-20240613-p5jlh0.html,4
Brisbane Times,2024_06_14_21,‘Be dominant’: Message to Broncos phenom before announcing NRL case,https://www.brisbanetimes.com.au/sport/nrl/be-dominant-message-to-broncos-phenom-before-announcing-nrl-case-20240611-p5jl0w.html,5
Brisbane Times,2024_06_14_21,Document reveals Brisbane toll tunnel could cost $10 billion to build,https://www.brisbanetimes.com.au/national/queensland/document-reveals-brisbane-toll-tunnel-could-cost-10-billion-to-build-20240613-p5jllp.html,6
Brisbane Times,2024_06_14_21,Housing and dumped hydro details in LNP’s election-focused budget reply,https://www.brisbanetimes.com.au/politics/queensland/housing-and-dumped-hydro-details-in-lnp-s-election-focused-budget-reply-20240613-p5jleu.html,7
Brisbane Times,2024_06_14_21,Brisbane was poised to host multiple Taylor Swift Eras shows. Then there was trouble in Japan,https://www.brisbanetimes.com.au/national/queensland/brisbane-was-poised-to-host-multiple-taylor-swift-eras-shows-then-there-was-trouble-in-japan-20240613-p5jlgj.html,8
Brisbane Times,2024_06_14_21,‘My intention is to keep both of them’: Broncos’ fight to retain star pair,https://www.brisbanetimes.com.au/sport/nrl/my-intention-is-to-keep-both-of-them-broncos-fight-to-retain-star-pair-20240613-p5jlgt.html,9
9News,2024_06_14_21,North Sydney to be abolished at next election in major blow to independents - 9News,https://news.google.com/rss/articles/CBMiggFodHRwczovL3d3dy45bmV3cy5jb20uYXUvbmF0aW9uYWwvbm9ydGgtc3lkbmV5LWVsZWN0b3JhdGUtYWJvbGlzaGVkLWFlYy0yMDI0LWZlZGVyYWwtZWxlY3Rpb24vYjZhMWIyNTQtNWQ1ZC00ZGEzLWE0YWMtMjBlZjU2MTZjMzJk0gFFaHR0cHM6Ly9hbXAuOW5ld3MuY29tLmF1L2FydGljbGUvYjZhMWIyNTQtNWQ1ZC00ZGEzLWE0YWMtMjBlZjU2MTZjMzJk?oc=5&hl=en-US&gl=US&ceid=US:en,1
The Age,2024_06_14_21,Man from family linked to the AFL charged with rapes - The Age,https://news.google.com/rss/articles/CBMidWh0dHBzOi8vd3d3LnRoZWFnZS5jb20uYXUvbmF0aW9uYWwvdmljdG9yaWEvbWFuLWZyb20tZmFtaWx5LWxpbmtlZC10by10aGUtYWZsLWNoYXJnZWQtd2l0aC1yYXBlcy0yMDI0MDYxNC1wNWpsd3YuaHRtbNIBdWh0dHBzOi8vYW1wLnRoZWFnZS5jb20uYXUvbmF0aW9uYWwvdmljdG9yaWEvbWFuLWZyb20tZmFtaWx5LWxpbmtlZC10by10aGUtYWZsLWNoYXJnZWQtd2l0aC1yYXBlcy0yMDI0MDYxNC1wNWpsd3YuaHRtbA?oc=5&hl=en-US&gl=US&ceid=US:en,2
9News,2024_06_14_21,Jury sent away to deliberate on campers murder trial - 9News,https://news.google.com/rss/articles/CBMihQFodHRwczovL3d3dy45bmV3cy5jb20uYXUvbmF0aW9uYWwvZ3JlZy1seW5uLWp1cnktc2VudC1hd2F5LXRvLWRlbGliZXJhdGUtb24tY2FtcGVycy1tdXJkZXItdHJpYWwvMGIzNWM0MDYtOTU1Zi00NjliLTljNDctYTcxZTU3NjYxMWQx0gFFaHR0cHM6Ly9hbXAuOW5ld3MuY29tLmF1L2FydGljbGUvMGIzNWM0MDYtOTU1Zi00NjliLTljNDctYTcxZTU3NjYxMWQx?oc=5&hl=en-US&gl=US&ceid=US:en,3
The Age,2024_06_14_21,Teachers told to ignore Victoria’s phonics push as union lashes deputy premier - The Age,https://news.google.com/rss/articles/CBMikQFodHRwczovL3d3dy50aGVhZ2UuY29tLmF1L25hdGlvbmFsL3ZpY3RvcmlhL3RlYWNoZXJzLXRvbGQtdG8taWdub3JlLWdvdmVybm1lbnQtcy1waG9uaWNzLXB1c2gtYXMtdW5pb24tbGFzaGVzLWRlcHV0eS1wcmVtaWVyLTIwMjQwNjE0LXA1amx2aC5odG1s0gGRAWh0dHBzOi8vYW1wLnRoZWFnZS5jb20uYXUvbmF0aW9uYWwvdmljdG9yaWEvdGVhY2hlcnMtdG9sZC10by1pZ25vcmUtZ292ZXJubWVudC1zLXBob25pY3MtcHVzaC1hcy11bmlvbi1sYXNoZXMtZGVwdXR5LXByZW1pZXItMjAyNDA2MTQtcDVqbHZoLmh0bWw?oc=5&hl=en-US&gl=US&ceid=US:en,4
Sky News Australia,2024_06_14_21,‘I just did’: PM snaps at media amid grilling over John Setka’s AFL threats - Sky News Australia,https://news.google.com/rss/articles/CBMi1AFodHRwczovL3d3dy5za3luZXdzLmNvbS5hdS9hdXN0cmFsaWEtbmV3cy9wb2xpdGljcy9maXJlZHVwLWFudGhvbnktYWxiYW5lc2Utc25hcHMtYmFjay1hdC1yZXBvcnRlcnMtYWZ0ZXItaW50ZW5zZS1xdWVzdGlvbmluZy1vdmVyLWNmbWV1cy1qb2huLXNldGthcy10aHJlYXRzLXRvLXRoZS1hZmwvbmV3cy1zdG9yeS9mNzA5MWYwYTM0ZDA5OGRhYTJiOWI1ZmY1NTg0M2QxMNIB2AFodHRwczovL3d3dy5za3luZXdzLmNvbS5hdS9hdXN0cmFsaWEtbmV3cy9wb2xpdGljcy9maXJlZHVwLWFudGhvbnktYWxiYW5lc2Utc25hcHMtYmFjay1hdC1yZXBvcnRlcnMtYWZ0ZXItaW50ZW5zZS1xdWVzdGlvbmluZy1vdmVyLWNmbWV1cy1qb2huLXNldGthcy10aHJlYXRzLXRvLXRoZS1hZmwvbmV3cy1zdG9yeS9mNzA5MWYwYTM0ZDA5OGRhYTJiOWI1ZmY1NTg0M2QxMD9hbXA?oc=5&hl=en-US&gl=US&ceid=US:en,5
Yahoo News Australia,2024_06_14_21,Mum calls out 'low-class bogan' parenting after lazy act at Aussie cafe - Yahoo News Australia,https://news.google.com/rss/articles/CBMibmh0dHBzOi8vYXUubmV3cy55YWhvby5jb20vbXVtLWNhbGxzLW91dC1sb3ctY2xhc3MtYm9nYW4tcGFyZW50aW5nLWFmdGVyLWxhenktYWN0LWF0LWF1c3NpZS1jYWZlLTA3MTMyMzE5NS5odG1s0gEA?oc=5&hl=en-US&gl=US&ceid=US:en,6
ABC News,2024_06_14_21,"Elective surgeries resume, but some procedures still on hold while code yellow emergency remains - ABC News",https://news.google.com/rss/articles/CBMib2h0dHBzOi8vd3d3LmFiYy5uZXQuYXUvbmV3cy8yMDI0LTA2LTE0L2VsZWN0aXZlLXN1cmdlcmllcy1yZXN1bWUtYW1pZC1vbmdvaW5nLXNhLWhvc3BpdGFsLWNvZGUteWVsbG93LzEwMzk4MDIxMtIBKGh0dHBzOi8vYW1wLmFiYy5uZXQuYXUvYXJ0aWNsZS8xMDM5ODAyMTI?oc=5&hl=en-US&gl=US&ceid=US:en,7
ABC News,2024_06_14_21,Police offer $1 million reward to solve the cold case of Melbourne mother Maria James - ABC News,https://news.google.com/rss/articles/CBMiZGh0dHBzOi8vd3d3LmFiYy5uZXQuYXUvbmV3cy8yMDI0LTA2LTE0L21hcmlhLWphbWVzLWNvbGQtY2FzZS1tdXJkZXItdmljdG9yaWEtcG9saWNlLXJld2FyZC8xMDM5NzIwNzDSAShodHRwczovL2FtcC5hYmMubmV0LmF1L2FydGljbGUvMTAzOTcyMDcw?oc=5&hl=en-US&gl=US&ceid=US:en,8
Sky News Australia,2024_06_14_21,‘Will not be tolerated’: War Memorial defaced with pro-Palestine graffiti - Sky News Australia,https://news.google.com/rss/articles/CBMi1gFodHRwczovL3d3dy5za3luZXdzLmNvbS5hdS9hdXN0cmFsaWEtbmV3cy9jcmltZS93aWxsLW5vdC1iZS10b2xlcmF0ZWQtYWN0LXBvbGljZS1vbi10aGUtaHVudC1mb3ItYnJhemVuLWdyYWZmaXRpLWFydGlzdC13aG8tZGVmYWNlZC13YXItbWVtb3JpYWwtd2l0aC1wcm9wYWxlc3RpbmUtc2xvZ2Fucy9uZXdzLXN0b3J5LzIwZTI0ZGE5ZTE5NjkwYzdjYTQ1Yzc0YmFmZmVjZWE40gHaAWh0dHBzOi8vd3d3LnNreW5ld3MuY29tLmF1L2F1c3RyYWxpYS1uZXdzL2NyaW1lL3dpbGwtbm90LWJlLXRvbGVyYXRlZC1hY3QtcG9saWNlLW9uLXRoZS1odW50LWZvci1icmF6ZW4tZ3JhZmZpdGktYXJ0aXN0LXdoby1kZWZhY2VkLXdhci1tZW1vcmlhbC13aXRoLXByb3BhbGVzdGluZS1zbG9nYW5zL25ld3Mtc3RvcnkvMjBlMjRkYTllMTk2OTBjN2NhNDVjNzRiYWZmZWNlYTg_YW1w?oc=5&hl=en-US&gl=US&ceid=US:en,9
The Age,2024_06_14_21,‘Hands off our hospital’: Victorian towns fighting to keep health services - The Age,https://news.google.com/rss/articles/CBMiiAFodHRwczovL3d3dy50aGVhZ2UuY29tLmF1L3BvbGl0aWNzL3ZpY3RvcmlhL2hhbmRzLW9mZi1vdXItaG9zcGl0YWwtdmljdG9yaWFuLXRvd25zLWZpZ2h0aW5nLXRvLWtlZXAtaGVhbHRoLXNlcnZpY2VzLTIwMjQwNjEyLXA1amw5ay5odG1s0gGIAWh0dHBzOi8vYW1wLnRoZWFnZS5jb20uYXUvcG9saXRpY3MvdmljdG9yaWEvaGFuZHMtb2ZmLW91ci1ob3NwaXRhbC12aWN0b3JpYW4tdG93bnMtZmlnaHRpbmctdG8ta2VlcC1oZWFsdGgtc2VydmljZXMtMjAyNDA2MTItcDVqbDlrLmh0bWw?oc=5&hl=en-US&gl=US&ceid=US:en,10
9News,2024_06_14_21,Heat forces Greek authorities to shut down Acropolis during afternoon hours for a second day - 9News,https://news.google.com/rss/articles/CBMinQFodHRwczovL3d3dy45bmV3cy5jb20uYXUvd29ybGQvZ3JlZWNlLWhlYXQtd2F2ZS1hY3JvcG9saXMtc2h1dC1kb3duLWR1cmluZy1hZnRlcm5vb24tZm9yLXNlY29uZC1kYXktYW1pZC1leHRyZW1lLXdlYXRoZXIvMDY2NDg2NTItZDQ5MC00Njc2LTlmODgtZTQ5NDY1ZmQ3YzNh0gFFaHR0cHM6Ly9hbXAuOW5ld3MuY29tLmF1L2FydGljbGUvMDY2NDg2NTItZDQ5MC00Njc2LTlmODgtZTQ5NDY1ZmQ3YzNh?oc=5&hl=en-US&gl=US&ceid=US:en,11
Sydney Morning Herald,2024_06_14_21,"Zelensky just signed a ‘historic’ deal. However, the next 48 hours will be crucial for Ukraine - Sydney Morning Herald",https://news.google.com/rss/articles/CBMikwFodHRwczovL3d3dy5zbWguY29tLmF1L3dvcmxkL2V1cm9wZS96ZWxlbnNreS1qdXN0LXNpZ25lZC1hLWhpc3RvcmljLWRlYWwtaG93ZXZlci10aGUtbmV4dC00OC1ob3Vycy13aWxsLWJlLWNydWNpYWwtZm9yLXVrcmFpbmUtMjAyNDA2MTQtcDVqbHMxLmh0bWzSAZMBaHR0cHM6Ly9hbXAuc21oLmNvbS5hdS93b3JsZC9ldXJvcGUvemVsZW5za3ktanVzdC1zaWduZWQtYS1oaXN0b3JpYy1kZWFsLWhvd2V2ZXItdGhlLW5leHQtNDgtaG91cnMtd2lsbC1iZS1jcnVjaWFsLWZvci11a3JhaW5lLTIwMjQwNjE0LXA1amxzMS5odG1s?oc=5&hl=en-US&gl=US&ceid=US:en,12
ABC News,2024_06_14_21,"For the first time, Israel's military and Hamas are added to a global blacklist of offenders that harm children - ABC News",https://news.google.com/rss/articles/CBMiW2h0dHBzOi8vd3d3LmFiYy5uZXQuYXUvbmV3cy8yMDI0LTA2LTE0L2lzcmFlbC1taWxpdGFyeS1hbmQtaGFtYXMtYWRkZWQtdG8tdW4tbGlzdC8xMDM5NjUxODTSAQA?oc=5&hl=en-US&gl=US&ceid=US:en,13
Hindustan Times,2024_06_14_21,Putin’s UN Envoy Slams U.S. & UK Over Red Sea Tensions; ‘Attacks On Yemen Leave A Stain Of Blood…’ - Hindustan Times,https://news.google.com/rss/articles/CCAiC2ZPZzl4VXBGQXRjmAEB?oc=5&hl=en-US&gl=US&ceid=US:en,14
news.com.au,2024_06_14_21,ASX drifts lower on China woes - news.com.au,https://news.google.com/rss/articles/CBMinQFodHRwczovL3d3dy5uZXdzLmNvbS5hdS9maW5hbmNlL21hcmtldHMvYXVzdHJhbGlhbi1tYXJrZXRzL2FzeDIwMC1lbmRzLXRoZS13ZWVrLWxvd2VyLW9uLWNoaW5hLXdvZXMtaXJvbi1vcmUtZmFsbC9uZXdzLXN0b3J5L2FkNTk3MjU3ZDA4ZjkyOTYwZmNmYmQzZTRkNjk2Mjdh0gGhAWh0dHBzOi8vd3d3Lm5ld3MuY29tLmF1L2ZpbmFuY2UvbWFya2V0cy9hdXN0cmFsaWFuLW1hcmtldHMvYXN4MjAwLWVuZHMtdGhlLXdlZWstbG93ZXItb24tY2hpbmEtd29lcy1pcm9uLW9yZS1mYWxsL25ld3Mtc3RvcnkvYWQ1OTcyNTdkMDhmOTI5NjBmY2ZiZDNlNGQ2OTYyN2E_YW1w?oc=5&hl=en-US&gl=US&ceid=US:en,15
ABC News (Australia),2024_06_14_21,Elon Musk’s big payday courtesy of Tesla's shareholders | Finance Report | ABC News - ABC News (Australia),https://news.google.com/rss/articles/CCAiC0tfaDN4bE1CSWdzmAEB?oc=5&hl=en-US&gl=US&ceid=US:en,16
9 News Australia,2024_06_14_21,Australia's unemployment rate falls | 9 News Australia - 9 News Australia,https://news.google.com/rss/articles/CCAiC3c2alB0ZlpNR0VBmAEB?oc=5&hl=en-US&gl=US&ceid=US:en,17
Sydney Morning Herald,2024_06_14_21,Telstra ditches carbon credits to push harder on direct emissions - Sydney Morning Herald,https://news.google.com/rss/articles/CBMieGh0dHBzOi8vd3d3LnNtaC5jb20uYXUvdGVjaG5vbG9neS90ZWxzdHJhLWRpdGNoZXMtY2FyYm9uLWNyZWRpdHMtdG8tcHVzaC1oYXJkZXItb24tZGlyZWN0LWVtaXNzaW9ucy0yMDI0MDYxMy1wNWpsa2EuaHRtbNIBeGh0dHBzOi8vYW1wLnNtaC5jb20uYXUvdGVjaG5vbG9neS90ZWxzdHJhLWRpdGNoZXMtY2FyYm9uLWNyZWRpdHMtdG8tcHVzaC1oYXJkZXItb24tZGlyZWN0LWVtaXNzaW9ucy0yMDI0MDYxMy1wNWpsa2EuaHRtbA?oc=5&hl=en-US&gl=US&ceid=US:en,18
Kotaku Australia,2024_06_14_21,"JB Hi-Fi Drops Yet Another Gaming Sale, This Time Slashes Almost All Console Prices - Kotaku Australia",https://news.google.com/rss/articles/CBMiRWh0dHBzOi8vd3d3LmtvdGFrdS5jb20uYXUvMjAyNC8wNi9qYi1oaS1maS1nZWFyLXVwLWdhbWluZy1zYWxlLWRlYWxzL9IBAA?oc=5&hl=en-US&gl=US&ceid=US:en,19
Forbes,2024_06_14_21,"Apple Debuts Intelligence, Mistral Raises $600 Million, New AI Text-To-Video - Forbes",https://news.google.com/rss/articles/CBMifmh0dHBzOi8vd3d3LmZvcmJlcy5jb20vc2l0ZXMvY2hhcmxpZWZpbmsvMjAyNC8wNi8xMy9hcHBsZS1kZWJ1dHMtaW50ZWxsaWdlbmNlLW1pc3RyYWwtcmFpc2VzLTYwMC1taWxsaW9uLW5ldy1haS10ZXh0LXRvLXZpZGVvL9IBAA?oc=5&hl=en-US&gl=US&ceid=US:en,20
News-Medical.Net,2024_06_14_21,Key Insights into Biological Safety Cabinets - News-Medical.Net,https://news.google.com/rss/articles/CBMiXGh0dHBzOi8vd3d3Lm5ld3MtbWVkaWNhbC5uZXQvbmV3cy8yMDI0MDYxNC9LZXktSW5zaWdodHMtaW50by1CaW9sb2dpY2FsLVNhZmV0eS1DYWJpbmV0cy5hc3B40gEA?oc=5&hl=en-US&gl=US&ceid=US:en,21
ZDNet,2024_06_14_21,Apple CarPlay is getting an upgrade - here are the coolest features announced at WWDC 2024 - ZDNet,https://news.google.com/rss/articles/CBMid2h0dHBzOi8vd3d3LnpkbmV0LmNvbS9hcnRpY2xlL2FwcGxlLWNhcnBsYXktaXMtZ2V0dGluZy1hbi11cGdyYWRlLWhlcmUtYXJlLXRoZS1jb29sZXN0LWZlYXR1cmVzLWFubm91bmNlZC1hdC13d2RjLTIwMjQv0gEA?oc=5&hl=en-US&gl=US&ceid=US:en,22
news.com.au,2024_06_14_21,Meghan detail nobody has noticed - news.com.au,https://news.google.com/rss/articles/CBMiiAFodHRwczovL3d3dy5uZXdzLmNvbS5hdS9lbnRlcnRhaW5tZW50L2NlbGVicml0eS1saWZlL3JveWFscy9tZWdoYW4tZGV0YWlsLW5vYm9keS1oYXMtbm90aWNlZC9uZXdzLXN0b3J5LzYzOTZkZTE1OTkwYTdiYzFiYmFmODg0Y2YzNWJlMzNh0gEA?oc=5&hl=en-US&gl=US&ceid=US:en,23
9News,2024_06_14_21,Australia's oldest working artist and former Archibald winner Guy Warren dies aged 103 - 9News,https://news.google.com/rss/articles/CBMib2h0dHBzOi8vd3d3LjluZXdzLmNvbS5hdS9uYXRpb25hbC9hcmNoaWJhbGQtd2lubmVyLWd1eS13YXJyZW4tZGllcy1hZ2UtMTAzL2E0ZGM5MzhjLWQxMWUtNGY5YS1iNzQwLWM1MTIwNmYyM2ExMdIBRWh0dHBzOi8vYW1wLjluZXdzLmNvbS5hdS9hcnRpY2xlL2E0ZGM5MzhjLWQxMWUtNGY5YS1iNzQwLWM1MTIwNmYyM2ExMQ?oc=5&hl=en-US&gl=US&ceid=US:en,24
news.com.au,2024_06_14_21,Tom Brady ‘stress’ ends Gisele’s romance - news.com.au,https://news.google.com/rss/articles/CBMiyAFodHRwczovL3d3dy5uZXdzLmNvbS5hdS9lbnRlcnRhaW5tZW50L2NlbGVicml0eS1saWZlL2hvb2stdXBzLWJyZWFrLXVwcy9naXNlbGUtYm5kY2hlbi1hbmQtam9hcXVpbS12YWxlbnRlLXJlcG9ydGVkbHktc3BsaXQtb3Zlci1zdHJlc3MtZnJvbS10b20tYnJhZHktcm9hc3QvbmV3cy1zdG9yeS84MzUyNTRmODE0YTgyNTU1NWE5NGM2MTFjMTExMWE4OdIBAA?oc=5&hl=en-US&gl=US&ceid=US:en,25
NME,2024_06_14_21,'The Boys' season four episode three ending explained: where does the red door lead? - NME,https://news.google.com/rss/articles/CBMiUGh0dHBzOi8vd3d3Lm5tZS5jb20vbmV3cy90di90aGUtYm95cy1zZWFzb24tNC1lcGlzb2RlLTMtZW5kaW5nLWV4cGxhaW5lZC0zNzY0NDM30gEA?oc=5&hl=en-US&gl=US&ceid=US:en,26
Nine,2024_06_14_21,"NRL LIVE scores 2024: Canberra Raiders vs North Queensland Cowboys; Brisbane Broncos vs South Sydney Rabbitohs Round 15 results, updates, highlights and latest news; Raiders boo'd by home fans with Ricky Stuart 'fuming'; Kyle Feldt - Nine",https://news.google.com/rss/articles/CBMioAFodHRwczovL3d3dy5uaW5lLmNvbS5hdS9zcG9ydC9ucmwvbGl2ZS1zY29yZXMtMjAyNC1yb3VuZC0xNS1mcmlkYXktcmFpZGVycy1jb3dib3lzLWJyb25jb3MtcmFiYml0b2hzLXJlc3VsdHMtdXBkYXRlcy1oaWdobGlnaHRzLWxhdGVzdC1uZXdzLTIwMjQwNjE0LXA1amx3Yy5odG1s0gEA?oc=5&hl=en-US&gl=US&ceid=US:en,27
SEN,2024_06_14_21,"TEAMS | Saints drop veteran, another big Crows call, star Tigers return & more - SEN",https://news.google.com/rss/articles/CBMicmh0dHBzOi8vd3d3LnNlbi5jb20uYXUvbmV3cy8yMDI0LzA2LzE0L3RlYW1zLW9yLXNhaW50cy1kcm9wLXZldGVyYW4tYW5vdGhlci1iaWctY3Jvd3MtY2FsbC13aXphcmQtcmV0dXJucy1hbmQtbW9yZdIBAA?oc=5&hl=en-US&gl=US&ceid=US:en,28
Nine,2024_06_14_21,Super Rugby Pacific AS IT HAPPENED: Slow starting Brumbies bullied by Blues in nightmare semi-final at Auckland's Eden Park - Nine,https://news.google.com/rss/articles/CBMilgFodHRwczovL3d3dy5uaW5lLmNvbS5hdS9zcG9ydC9ydWdieS9zdXBlci1wYWNpZmljLTIwMjQtbGl2ZS1zY29yZXMtYmx1ZXMtYnJ1bWJpZXMtcmVzdWx0cy1zZW1pZmluYWwtdXBkYXRlcy1uZXdzLXZpZGVvLWhpZ2hsaWdodHMtMjAyNDA2MTQtcDVqbHZ3Lmh0bWzSAUZodHRwczovL2FtcC5uaW5lLmNvbS5hdS9saXZlLWJsb2cvNDM2YThlNjEtZTQ5MS00Y2MzLWFjMDItZGFjNzg0ZDViMGUy?oc=5&hl=en-US&gl=US&ceid=US:en,29
Speedcafe,2024_06_14_21,Will Brown fastest in Darwin Supercars practice - Speedcafe,https://news.google.com/rss/articles/CBMiRmh0dHBzOi8vc3BlZWRjYWZlLmNvbS93aWxsLWJyb3duLWZhc3Rlc3QtaW4tZGFyd2luLXN1cGVyY2Fycy1wcmFjdGljZS_SAQA?oc=5&hl=en-US&gl=US&ceid=US:en,30
Mirage News,2024_06_14_21,Lab Now Able to Generate Pair Plasmas from Deep Space - Mirage News,https://news.google.com/rss/articles/CBMiU2h0dHBzOi8vd3d3Lm1pcmFnZW5ld3MuY29tL2xhYi1ub3ctYWJsZS10by1nZW5lcmF0ZS1wYWlyLXBsYXNtYXMtZnJvbS1kZWVwLTEyNTU3MzAv0gEA?oc=5&hl=en-US&gl=US&ceid=US:en,31
Mirage News,2024_06_14_21,NASA's Perseverance Crosses Old River to Hit Science Goal - Mirage News,https://news.google.com/rss/articles/CBMiT2h0dHBzOi8vd3d3Lm1pcmFnZW5ld3MuY29tL25hc2FzLXBlcnNldmVyYW5jZS1jcm9zc2VzLW9sZC1yaXZlci10by1oaXQtMTI1NTYzMi_SAQA?oc=5&hl=en-US&gl=US&ceid=US:en,32
9News,2024_06_14_21,"Astronaut's distress call from International Space Station a mistake, NASA says - 9News",https://news.google.com/rss/articles/CBMikQFodHRwczovL3d3dy45bmV3cy5jb20uYXUvd29ybGQvbmFzYS1zYXlzLWFzdHJvbmF1dHMtZGlzdHJlc3MtY2FsbC1mcm9tLWludGVybmF0aW9uYWwtc3BhY2Utc3RhdGlvbi1hLW1pc3Rha2UvYTYzN2NkMDItZGY0OS00OTJhLWI0OWEtMWQ2YjhjOGVkNTNl0gFFaHR0cHM6Ly9hbXAuOW5ld3MuY29tLmF1L2FydGljbGUvYTYzN2NkMDItZGY0OS00OTJhLWI0OWEtMWQ2YjhjOGVkNTNl?oc=5&hl=en-US&gl=US&ceid=US:en,33
9News,2024_06_14_21,The animal astronauts who paved the way for humans in space - 9News,https://news.google.com/rss/articles/CBMicWh0dHBzOi8vd3d3LjluZXdzLmNvbS5hdS93b3JsZC9hbmltYWxzLWluLXNwYWNlLXBpb25lZXItbm9uLWh1bWFuLWFzdHJvbmF1dHMvZWQ4ODQ4ZDYtMzgzZS00YmY4LTk1OWEtZWVkNmM5ZTZmMWU50gEA?oc=5&hl=en-US&gl=US&ceid=US:en,34
