publication,scraped_datetime,Headline,Url,Rank
Brisbane Times,2024_06_13_16,Brisbane News Live: Billion-dollar hole in BCC budget; Brisbane a 'bleisure' hotspot; Qld swim stars break world record - Brisbane Times,https://news.google.com/rss/articles/CBMivAFodHRwczovL3d3dy5icmlzYmFuZXRpbWVzLmNvbS5hdS9uYXRpb25hbC9xdWVlbnNsYW5kL2JyaXNiYW5lLW5ld3MtbGl2ZS1iaWxsaW9uLWRvbGxhci1ob2xlLWluLWJjYy1idWRnZXQtYnJpc2JhbmUtYS1ibGVpc3VyZS1ob3RzcG90LXFsZC1zd2ltLXN0YXJzLWJyZWFrLXdvcmxkLXJlY29yZC0yMDI0MDYxMi1wNWpsN3MuaHRtbNIBAA?oc=5&hl=en-US&gl=US&ceid=US:en,32
The University of Melbourne,2024_06_13_16,Get a face mask on campus - The University of Melbourne,https://news.google.com/rss/articles/CBMiSmh0dHBzOi8vc2FmZXR5LnVuaW1lbGIuZWR1LmF1L2Nvcm9uYXZpcnVzL2hlYWx0aC1hZHZpY2UvYnV0dG9ucy9mYWNlLW1hc2tz0gEA?oc=5&hl=en-US&gl=US&ceid=US:en,33
Mirage News,2024_06_13_16,Nottingham Scientist Bags Royal Society Chemistry Prize - Mirage News,https://news.google.com/rss/articles/CBMiS2h0dHBzOi8vd3d3Lm1pcmFnZW5ld3MuY29tL25vdHRpbmdoYW0tc2NpZW50aXN0LWJhZ3Mtcm95YWwtc29jaWV0eS0xMjU0NDMyL9IBAA?oc=5&hl=en-US&gl=US&ceid=US:en,34
Australian Hospital + Healthcare Bulletin,2024_06_13_16,Heavy menstrual bleeding — new Clinical Care Standard released - Australian Hospital + Healthcare Bulletin,https://news.google.com/rss/articles/CBMihwFodHRwczovL3d3dy5ob3NwaXRhbGhlYWx0aC5jb20uYXUvY29udGVudC9jbGluaWNhbC1zZXJ2aWNlcy9uZXdzL2hlYXZ5LW1lbnN0cnVhbC1ibGVlZGluZy1uZXctY2xpbmljYWwtY2FyZS1zdGFuZGFyZC1yZWxlYXNlZC02MDkxMTQ0OTHSAQA?oc=5&hl=en-US&gl=US&ceid=US:en,35
TalkTV,2024_06_13_16,"""Never Met A Vegan I've Liked Till You"" | Ultra Processed Vegan Food Can Increase Heart Disease - TalkTV",https://news.google.com/rss/articles/CCAiCzJvampPV2l2TUFRmAEB?oc=5&hl=en-US&gl=US&ceid=US:en,36
News-Medical.Net,2024_06_13_16,Replacing TV time with light activity or sleep boosts healthy aging odds - News-Medical.Net,https://news.google.com/rss/articles/CBMieGh0dHBzOi8vd3d3Lm5ld3MtbWVkaWNhbC5uZXQvbmV3cy8yMDI0MDYxMy9SZXBsYWNpbmctVFYtdGltZS13aXRoLWxpZ2h0LWFjdGl2aXR5LW9yLXNsZWVwLWJvb3N0cy1oZWFsdGh5LWFnaW5nLW9kZHMuYXNweNIBAA?oc=5&hl=en-US&gl=US&ceid=US:en,37
Medical Xpress,2024_06_13_16,Putting the brakes on chronic inflammation: Study discovers link between two key pathways - Medical Xpress,https://news.google.com/rss/articles/CBMiUmh0dHBzOi8vbWVkaWNhbHhwcmVzcy5jb20vbmV3cy8yMDI0LTA2LWNocm9uaWMtaW5mbGFtbWF0aW9uLWxpbmsta2V5LXBhdGh3YXlzLmh0bWzSAQA?oc=5&hl=en-US&gl=US&ceid=US:en,38
