publication,scraped_datetime,Headline,Url,Rank
SMH,2024_06_13_02,"As it happened: Report calls on PwC to name tax scandal leakers; Lehrmann caused $13k in property damage, landlord alleges",https://www.smh.com.au/national/australia-news-live-chalmers-vows-to-pilot-economy-to-a-soft-landing-hunter-biden-found-guilty-20240612-p5jl1j.html,1
SMH,2024_06_13_02,Jarryd Hayne walks out of jail after sexual assault convictions quashed,https://www.smh.com.au/national/nsw/jarryd-hayne-wins-appeal-over-sexual-assault-convictions-20240610-p5jkk8.html,2
SMH,2024_06_13_02,Why Hayne’s convictions were quashed – and why he might not face a retrial,https://www.smh.com.au/national/nsw/why-hayne-s-convictions-were-quashed-and-why-he-might-not-face-a-retrial-20240612-p5jl5m.html,3
SMH,2024_06_13_02,"MPs pocketed $200,000 working for disgraced super fund",https://www.smh.com.au/national/nsw/mps-pocketed-200-000-working-for-disgraced-super-fund-20240612-p5jl4y.html,4
SMH,2024_06_13_02,"How a gust of wind made a chairlift fall, seriously injuring three snowboarders",https://www.smh.com.au/national/nsw/how-a-gust-of-wind-made-a-chairlift-fall-seriously-injuring-three-snowboarders-20240611-p5jkwt.html,5
SMH,2024_06_13_02,The way you pay is costing you big time. Here’s how to play your cards right,https://www.smh.com.au/business/banking-and-finance/the-way-you-pay-is-costing-you-big-time-here-s-how-to-play-your-cards-right-20240609-p5jkfy.html,6
SMH,2024_06_13_02,"No snow, but queues form as Australia’s first ‘alpine coaster’ opens",https://www.smh.com.au/traveller/travel-news/no-snow-but-queues-form-as-australia-s-first-alpine-coaster-opens-20240606-p5jjup.html,7
SMH,2024_06_13_02,The best water filters to protect your home from PFAS forever chemicals,https://www.smh.com.au/national/the-best-water-filters-to-protect-your-home-from-pfas-forever-chemicals-20240611-p5jkxn.html,8
SMH,2024_06_13_02,‘There’s no safe level’: Carcinogens found in tap water across Australia,https://www.smh.com.au/national/there-s-no-safe-level-carcinogens-found-in-tap-water-across-australia-20240606-p5jjq3.html,9
ABC,2024_06_13_02,"Singapore Airlines offer of compensation to passengers 'insulting', former senator says",https://www.abc.net.au/news/2024-06-12/singapore-airlines-compensation-nick-xenophon/103966888,1
ABC,2024_06_13_02,Abdullah watched as Israeli special forces rescued four hostages of Hamas,https://www.abc.net.au/news/2024-06-12/israeli-raid-gaza-refugee-camp-detailed-by-witness/103969446,2
ABC,2024_06_13_02,Ariarne Titmus smashes 200m world record in stunning head-to-head with Mollie O'Callaghan,https://www.abc.net.au/news/2024-06-12/world-record-womens-200m-freestyle-australian-swimming-trials/103969308,3
ABC,2024_06_13_02,Navy boat gifted by Australia to Fiji stranded on reef after maiden voyage,https://www.abc.net.au/news/2024-06-12/fiji-navy-patrol-boat-runs-aground-australia-donated-rfns-puamau/103967202,4
ABC,2024_06_13_02,"Basketball legend behind NBA logo inspiration, Jerry West dead at 86",https://www.abc.net.au/news/2024-06-13/nba-legend-jerry-west-dies-86/103971116,5
News,2024_06_13_02,Big change coming for billion iPhone users,https://www.news.com.au/technology/gadgets/mobile-phones/apple-partners-with-openai-as-it-unveils-apple-intelligence-new-ios-features/news-story/9e5895bf87be90c25b44ad8c2bae14d4,1
News,2024_06_13_02,‘Bloody joke’: Landlords lose it over new rules,https://www.news.com.au/finance/real-estate/renting/victorian-landlords-threaten-mass-exodus-over-proposed-rental-rules/news-story/2e6d34bea5d8d1b04ae8f3477ae8e51c,2
News,2024_06_13_02,Teen ripped apart in front of mum,https://www.news.com.au/travel/travel-updates/incidents/teen-who-lost-hand-leg-in-florida-shark-attack-was-on-first-beach-holiday-with-mother/news-story/3b9797da9f60c7b01ae8010a651ae105,3
News,2024_06_13_02,Kate issues rare message: ‘I’m deeply sorry’,https://www.news.com.au/entertainment/celebrity-life/royals/kate-middleton-issues-rare-message-after-missing-key-royal-engagement/news-story/765250d704035c888aa5058ae93ee574,4
News,2024_06_13_02,‘Made up’: Major twist in Titan sub saga,https://www.news.com.au/travel/travel-updates/incidents/twist-in-titan-sub-saga-frightening-log-account-from-submersible-found-to-be-fake/news-story/fc48ad4d83653b9a1e0f610eaea1d118,5
The Guardian,2024_06_13_02,‘Disregard for truth’: inquiry calls for greater scrutiny of private consultants following PwC tax scandal,https://www.theguardian.com/business/article/2024/jun/12/pwc-report-senate-inquiry-calls-for-greater-scrutiny-of-private-consultants-ntwnfb,1
The Guardian,2024_06_13_02,"The sad, stupid rise of the sigma male: how toxic masculinity took over social media",https://www.theguardian.com/society/article/2024/jun/12/the-sad-stupid-rise-of-the-sigma-male-how-toxic-masculinity-took-over-social-media,2
The Guardian,2024_06_13_02,"I used to be a top, but it no longer works for me. How do I tell my partner I’ve become a side?",https://www.theguardian.com/lifeandstyle/article/2024/jun/12/i-used-to-be-a-top-but-it-no-longer-works-for-me-how-do-i-tell-my-partner-ive-become-a-side,3
The Guardian,2024_06_13_02,New South Wales universities receive 40% of student fees from just three overseas countries,https://www.theguardian.com/australia-news/article/2024/jun/12/new-south-wales-universities-student-fees-international-percentage-china-india-nepal,4
The Guardian,2024_06_13_02,Denmark recalls South Korean firm’s instant noodles for being too spicy,https://www.theguardian.com/world/article/2024/jun/12/denmark-recalls-south-korean-firms-instant-noodles-for-being-too-spicy-samyang-foods-buldak,5
The Guardian,2024_06_13_02,A moment that changed me: I’m 58 and single since 1997. A Sex and the City meme transformed my life,https://www.theguardian.com/lifeandstyle/article/2024/jun/12/a-moment-that-changed-me-58-and-single-since-1997-sex-and-the-city-meme-transformed-my-life,6
The Guardian,2024_06_13_02,"Hamas has proposed ‘unworkable’ changes to ceasefire plan, Blinken says – as it happened",https://www.theguardian.com/world/live/2024/jun/12/israel-gaza-war-middle-east-hamas-ceasefire-deal-lebanon-hezbollah,7
The Guardian,2024_06_13_02,South Australia introduces ‘world-leading’ bill to ban political donations from elections,https://www.theguardian.com/australia-news/article/2024/jun/12/south-australia-introduces-world-leading-bill-to-ban-political-donations-from-elections,8
The Guardian,2024_06_13_02,Why were we evicted? I had to ask the new tenant to find out – and the reason cuts to the heart of the UK’s housing crisis,https://www.theguardian.com/commentisfree/article/2024/jun/11/renters-labour-no-fault-evictions-reform-housing,9
The Guardian,2024_06_13_02,"Bruce Lehrmann’s former landlord claims he caused $13,250 damage to home Seven Network paid for",https://www.theguardian.com/media/article/2024/jun/12/bruce-lehrmanns-former-landlord-claims-he-caused-13250-damage-to-home-seven-network-paid-for,10
The Age,2024_06_13_02,Petracca waiting to leave ICU as opponent’s concern for injured Demon is revealed,https://www.theage.com.au/sport/afl/christian-petracca-waiting-to-leave-icu-as-opponent-s-concern-for-injured-demon-is-revealed-20240612-p5jl2t.html,1
The Age,2024_06_13_02,‘Done an outstanding job’: AFL hits back as Setka calls for McBurney’s sacking,https://www.theage.com.au/sport/afl/done-an-outstanding-job-afl-hits-back-as-setka-calls-for-mcburney-s-sacking-20240612-p5jl3v.html,2
The Age,2024_06_13_02,Private schools oppose right to disconnect for teachers,https://www.theage.com.au/politics/federal/private-schools-oppose-right-to-disconnect-for-teachers-20240611-p5jksb.html,3
The Age,2024_06_13_02,Don’t be a slob: How to dress when you’re travelling,https://www.theage.com.au/traveller/reviews-and-advice/don-t-be-a-slob-how-to-dress-when-you-re-travelling-20240611-p5jkyp.html,4
The Age,2024_06_13_02,Owen loved being a principal. But he never wants to set foot in a school again,https://www.theage.com.au/national/victoria/owen-loved-being-a-principal-but-he-never-wants-to-set-foot-in-a-school-again-20240611-p5jky3.html,5
The Age,2024_06_13_02,Fit for office: Former MP Gladys Liu gets her personal trainer’s ticket,https://www.theage.com.au/national/fit-for-office-former-mp-gladys-liu-gets-her-personal-trainer-s-ticket-20240611-p5jkwx.html,6
The Age,2024_06_13_02,Melbourne property prices are flatlining. Has the world’s most liveable city lost its mojo?,https://www.theage.com.au/national/victoria/melbourne-property-prices-are-dropping-has-the-world-s-most-liveable-city-lost-its-mojo-20240607-p5jk65.html,7
The Age,2024_06_13_02,Landlord rates could double under this councillor’s contentious housing proposal,https://www.theage.com.au/national/victoria/landlord-rates-could-double-under-this-councillor-s-contentious-housing-proposal-20240611-p5jksf.html,8
The Age,2024_06_13_02,Fifty Bacchus Marsh Grammar girls targeted with AI fake nudes,https://www.theage.com.au/national/victoria/fifty-bacchus-marsh-grammar-girls-targeted-with-ai-fake-nudes-20240611-p5jky6.html,9
Brisbane Times,2024_06_13_02,"Australian swimming trials as it happened: Ariarne Titmus breaks 200m freestyle world record, McEvoy qualifies for fourth Games",https://www.brisbanetimes.com.au/sport/swimming/australian-swimming-trials-live-titmus-o-callaghan-showdown-headlines-night-three-20240612-p5jl29.html,1
Brisbane Times,2024_06_13_02,Richard is unhappy his rates are rising. How does your suburb fare?,https://www.brisbanetimes.com.au/politics/queensland/richard-is-unhappy-his-rates-are-rising-how-does-your-suburb-fare-20240612-p5jl67.html,2
Brisbane Times,2024_06_13_02,"‘Callous, brutal, unprovoked’: Pair charged with murder after remains found at quarry",https://www.brisbanetimes.com.au/national/queensland/pair-charged-with-murder-after-remains-found-at-quarry-20240612-p5jl32.html,3
Brisbane Times,2024_06_13_02,"As it happened: Brisbane on Wednesday, June 12",https://www.brisbanetimes.com.au/national/queensland/as-it-happened-brisbane-on-wednesday-june-12-20240611-p5jkw8.html,4
Brisbane Times,2024_06_13_02,Brisbane ratepayers hit with an average $104 increase in council budget,https://www.brisbanetimes.com.au/national/queensland/brisbane-ratepayers-hit-with-an-average-104-increase-in-council-budget-20240612-p5jl2q.html,5
Brisbane Times,2024_06_13_02,"Public servants could be moved out of CBD, urged to WFH to cut costs",https://www.brisbanetimes.com.au/national/queensland/public-servants-could-be-moved-out-of-cbd-urged-to-wfh-to-cut-costs-20240611-p5jkvt.html,6
Brisbane Times,2024_06_13_02,Broncos rookie at heart of fight to overcome concerning trend,https://www.brisbanetimes.com.au/sport/nrl/broncos-rookie-at-heart-of-fight-to-overcome-concerning-trend-20240611-p5jkrl.html,7
Brisbane Times,2024_06_13_02,Australians average 13.3 sexual partners in a lifetime. That doesn’t seem like many to me,https://www.brisbanetimes.com.au/lifestyle/life-and-relationships/australians-average-13-3-sexual-partners-in-a-lifetime-that-doesn-t-seem-like-many-to-me-20240521-p5jfg9.html,8
Brisbane Times,2024_06_13_02,Budget green light for Gympie Road bypass tunnel to move to next stage,https://www.brisbanetimes.com.au/national/queensland/budget-green-light-for-gympie-road-bypass-tunnel-to-move-to-next-stage-20240610-p5jkln.html,9
ABC News,2024_06_13_02,Abdullah Joudeh was in Gaza's Nuseirat Refugee Camp 5 when Israeli special forces rescued four Hamas hostages - ABC News,https://news.google.com/rss/articles/CBMiY2h0dHBzOi8vd3d3LmFiYy5uZXQuYXUvbmV3cy8yMDI0LTA2LTEyL2lzcmFlbGktcmFpZC1nYXphLXJlZnVnZWUtY2FtcC1kZXRhaWxlZC1ieS13aXRuZXNzLzEwMzk2OTQ0NtIBKGh0dHBzOi8vYW1wLmFiYy5uZXQuYXUvYXJ0aWNsZS8xMDM5Njk0NDY?oc=5&hl=en-US&gl=US&ceid=US:en,1
9News,2024_06_13_02,Wedding proposal gone wrong leads to weeks in hospital - 9News,https://news.google.com/rss/articles/CBMifWh0dHBzOi8vd3d3LjluZXdzLmNvbS5hdS9uYXRpb25hbC93ZWRkaW5nLXByb3Bvc2FsLWdvbmUtd3JvbmctbGVhZHMtdG8td2Vla3MtaW4taG9zcGl0YWwvNjcyMzhlZDMtYTE2NC00OGQwLWFkMmItYWJmZWQ5ZjhhYzNm0gFFaHR0cHM6Ly9hbXAuOW5ld3MuY29tLmF1L2FydGljbGUvNjcyMzhlZDMtYTE2NC00OGQwLWFkMmItYWJmZWQ5ZjhhYzNm?oc=5&hl=en-US&gl=US&ceid=US:en,2
ABC News,2024_06_13_02,"Lord Mayor Adrian Schrinner announces Brisbane City Council budget rate rise, changes to short-stay accommodation - ABC News",https://news.google.com/rss/articles/CBMibWh0dHBzOi8vd3d3LmFiYy5uZXQuYXUvbmV3cy8yMDI0LTA2LTEyL3FsZC1icmlzYmFuZS1jaXR5LWNvdW5jaWwtYnVkZ2V0LWxvcmQtbWF5b3ItYWRyaWFuLXNjaHJpbm5lci8xMDM5NjY4NjTSAShodHRwczovL2FtcC5hYmMubmV0LmF1L2FydGljbGUvMTAzOTY2ODY0?oc=5&hl=en-US&gl=US&ceid=US:en,3
The Age,2024_06_13_02,"Australia news LIVE: Littleproud says nuclear power plants welcome in Nationals’ seats, Israel, Hamas named and shamed by UN - The Age",https://news.google.com/rss/articles/CBMilgFodHRwczovL3d3dy50aGVhZ2UuY29tLmF1L25hdGlvbmFsL2F1c3RyYWxpYS1uZXdzLWxpdmUtY2hhbG1lcnMtdm93cy10by1waWxvdC1lY29ub215LXRvLWEtc29mdC1sYW5kaW5nLWh1bnRlci1iaWRlbi1mb3VuZC1ndWlsdHktMjAyNDA2MTItcDVqbDFqLmh0bWzSAZYBaHR0cHM6Ly9hbXAudGhlYWdlLmNvbS5hdS9uYXRpb25hbC9hdXN0cmFsaWEtbmV3cy1saXZlLWNoYWxtZXJzLXZvd3MtdG8tcGlsb3QtZWNvbm9teS10by1hLXNvZnQtbGFuZGluZy1odW50ZXItYmlkZW4tZm91bmQtZ3VpbHR5LTIwMjQwNjEyLXA1amwxai5odG1s?oc=5&hl=en-US&gl=US&ceid=US:en,4
SBS News,2024_06_13_02,'Visa hopping': Government tightens student visa rules further - SBS News,https://news.google.com/rss/articles/CBMieGh0dHBzOi8vd3d3LnNicy5jb20uYXUvbmV3cy9hcnRpY2xlL2dvdmVybm1lbnQtZnVydGhlci10aWdodGVucy1zdHVkZW50LXZpc2EtYXBwbGljYXRpb25zLXRvLXN0b3AtdmlzYS1ob3BwaW5nL3JnOG5xdGxsMdIBAA?oc=5&hl=en-US&gl=US&ceid=US:en,5
The Guardian,2024_06_13_02,Australia’s power and gas companies want Coalition to retain Labor’s 2030 climate target - The Guardian,https://news.google.com/rss/articles/CBMikgFodHRwczovL3d3dy50aGVndWFyZGlhbi5jb20vZW52aXJvbm1lbnQvYXJ0aWNsZS8yMDI0L2p1bi8xMi9hdXN0cmFsaWFzLXBvd2VyLWFuZC1nYXMtY29tcGFuaWVzLXdhbnQtY29hbGl0aW9uLXRvLXJldGFpbi1sYWJvcnMtMjAzMC1jbGltYXRlLXRhcmdldNIBkgFodHRwczovL2FtcC50aGVndWFyZGlhbi5jb20vZW52aXJvbm1lbnQvYXJ0aWNsZS8yMDI0L2p1bi8xMi9hdXN0cmFsaWFzLXBvd2VyLWFuZC1nYXMtY29tcGFuaWVzLXdhbnQtY29hbGl0aW9uLXRvLXJldGFpbi1sYWJvcnMtMjAzMC1jbGltYXRlLXRhcmdldA?oc=5&hl=en-US&gl=US&ceid=US:en,6
ABC News,2024_06_13_02,Parent outraged over 'incredibly graphic' fake images of Bacchus Marsh Grammar students - ABC News,https://news.google.com/rss/articles/CBMiaGh0dHBzOi8vd3d3LmFiYy5uZXQuYXUvbmV3cy8yMDI0LTA2LTEyL2JhY2NodXMtbWFyc2gtYWktaW1hZ2VzLWZha2UtbnVkZS1zdHVkZW50cy1waG90by1vbmxpbmUvMTAzOTY3NDAy0gEA?oc=5&hl=en-US&gl=US&ceid=US:en,7
ABC News,2024_06_13_02,"Senate report into PwC scandal released, ASX lower in afternoon trade — as it happened - ABC News",https://news.google.com/rss/articles/CBMiT2h0dHBzOi8vd3d3LmFiYy5uZXQuYXUvbmV3cy8yMDI0LTA2LTEyL2FzeC1tYXJrZXRzLWJ1c2luZXNzLWxpdmUtbmV3cy8xMDM5NjY4MDDSAQA?oc=5&hl=en-US&gl=US&ceid=US:en,8
9News,2024_06_13_02,Murder charge after man's remains found at abandoned quarry north of Brisbane - 9News,https://news.google.com/rss/articles/CBMimgFodHRwczovL3d3dy45bmV3cy5jb20uYXUvbmF0aW9uYWwvY2Fib29sdHVyZS1tdXJkZXItY2hhcmdlLWFmdGVyLW1hbnMtcmVtYWlucy1mb3VuZC1hdC1hYmFuZG9uZWQtcXVhcnJ5LWluLXF1ZWVuc2xhbmQvNzA2MTMxMGYtOTZkNi00MWE4LWE5YTItYzE0YTdmZmI1Zjk10gFFaHR0cHM6Ly9hbXAuOW5ld3MuY29tLmF1L2FydGljbGUvNzA2MTMxMGYtOTZkNi00MWE4LWE5YTItYzE0YTdmZmI1Zjk1?oc=5&hl=en-US&gl=US&ceid=US:en,9
Bloomberg,2024_06_13_02,"Australia 'Not Naive' on China as Li Visit Looms, Chalmers Says - Bloomberg",https://news.google.com/rss/articles/CBMib2h0dHBzOi8vd3d3LmJsb29tYmVyZy5jb20vbmV3cy9hcnRpY2xlcy8yMDI0LTA2LTEyL2F1c3RyYWxpYS1ub3QtbmFpdmUtb24tY2hpbmEtYXMtbGktdmlzaXQtbG9vbXMtY2hhbG1lcnMtc2F5c9IBAA?oc=5&hl=en-US&gl=US&ceid=US:en,10
ABC News,2024_06_13_02,"Gaza killings were a crime against humanity, UN inquiry finds - ABC News",https://news.google.com/rss/articles/CBMiZmh0dHBzOi8vd3d3LmFiYy5uZXQuYXUvbmV3cy8yMDI0LTA2LTEyL2dhemEta2lsbGluZ3MtY3JpbWUtYWdhaW5zdC1odW1hbml0eS11bi1pbnF1aXJ5LWZpbmRzLzEwMzk3MDQ2NNIBAA?oc=5&hl=en-US&gl=US&ceid=US:en,11
Sky News Australia,2024_06_13_02,‘Hopeful sign’ as Hamas responds to truce offer - Sky News Australia,https://news.google.com/rss/articles/CBMi1QFodHRwczovL3d3dy5za3luZXdzLmNvbS5hdS93b3JsZC1uZXdzL2dsb2JhbC1hZmZhaXJzL2hhbWFzLWV4cHJlc3Nlcy1yZWFkaW5lc3MtdG8tbmVnb3RpYXRlLWRldGFpbHMtYWZ0ZXItYWNjZXB0aW5nLXVuZW5kb3JzZWQtY2Vhc2VmaXJlLXBsYW4tYWltZWQtYXQtZW5kaW5nLXdhci1pbi1nYXphL25ld3Mtc3RvcnkvMTY5N2VmNjUzNjIwZGZhZTZmMTk1NTNhNzViYzJhZDPSAQA?oc=5&hl=en-US&gl=US&ceid=US:en,12
ABC News,2024_06_13_02,French President Emmanuel Macron says voting changes proposed for New Caledonia have been 'suspended' - ABC News,https://news.google.com/rss/articles/CBMiamh0dHBzOi8vd3d3LmFiYy5uZXQuYXUvbmV3cy8yMDI0LTA2LTEyL3ZvdGluZy1jaGFuZ2VzLXRoYXQtc3BhcmtlZC1uZXctY2FsZWRvbmlhLXJpb3RzLXN1c3BlbmRlZC8xMDM5NzA5NDDSAQA?oc=5&hl=en-US&gl=US&ceid=US:en,13
ABC News,2024_06_13_02,Suspect arrested over stabbing of four American teachers in China - ABC News,https://news.google.com/rss/articles/CBMiZ2h0dHBzOi8vd3d3LmFiYy5uZXQuYXUvbmV3cy8yMDI0LTA2LTExL3N1c3BlY3QtYXJyZXN0ZWQtb3Zlci1zdGFiYmluZy1hbWVyaWNhbi10ZWFjaGVycy1jaGluYS8xMDM5NjYyMTLSAShodHRwczovL2FtcC5hYmMubmV0LmF1L2FydGljbGUvMTAzOTY2MjEy?oc=5&hl=en-US&gl=US&ceid=US:en,14
ABC News (Australia),2024_06_13_02,ASX lower in afternoon trade | Finance Report | ABC News - ABC News (Australia),https://news.google.com/rss/articles/CCAiC0JQd092ZzFMWjRzmAEB?oc=5&hl=en-US&gl=US&ceid=US:en,15
9 News Australia,2024_06_13_02,More than 300 Bonza Airlines employees sacked | 9 News Australia - 9 News Australia,https://news.google.com/rss/articles/CCAiC012OWhFM3VlY19vmAEB?oc=5&hl=en-US&gl=US&ceid=US:en,16
ABC News (Australia),2024_06_13_02,Australian property prices show signs of acceleration after cooling period | ABC News - ABC News (Australia),https://news.google.com/rss/articles/CCAiC1JvMnVDMERQOUhvmAEB?oc=5&hl=en-US&gl=US&ceid=US:en,17
Yahoo Finance Australia,2024_06_13_02,BYD opens floodgate for new Chinese-made electric cars after death of Aussie industry - Yahoo Finance Australia,https://news.google.com/rss/articles/CBMihgFodHRwczovL2F1LmZpbmFuY2UueWFob28uY29tL25ld3MvYnlkLW9wZW5zLWZsb29kZ2F0ZS1mb3ItbmV3LWNoaW5lc2UtbWFkZS1lbGVjdHJpYy1jYXJzLWFmdGVyLWRlYXRoLW9mLWF1c3NpZS1pbmR1c3RyeS0wNDM3MTM2ODguaHRtbNIBAA?oc=5&hl=en-US&gl=US&ceid=US:en,18
Medical Device Network,2024_06_13_02,iPhone-independent real-time glucose readings now available on Apple Watch and G7 - Medical Device Network,https://news.google.com/rss/articles/CBMiYGh0dHBzOi8vd3d3Lm1lZGljYWxkZXZpY2UtbmV0d29yay5jb20vYW5hbHlzdC1jb21tZW50L3JlYWwtdGltZS1nbHVjb3NlLXJlYWRpbmdzLWFwcGxlLXdhdGNoLWc3L9IBAA?oc=5&hl=en-US&gl=US&ceid=US:en,19
The National,2024_06_13_02,"iOS 18: Release date, Apple Intelligence features and all you need to know - The National",https://news.google.com/rss/articles/CBMiaWh0dHBzOi8vd3d3LnRoZW5hdGlvbmFsbmV3cy5jb20vZnV0dXJlL3RlY2hub2xvZ3kvMjAyNC8wNi8xMi9pb3MtMTgtcmVsZWFzZS1kYXRlLWFwcGxlLWludGVsbGlnZW5jZS13aGF0L9IBAA?oc=5&hl=en-US&gl=US&ceid=US:en,20
Kotaku Australia,2024_06_13_02,"A Major Australian Games Studio Is Closing Its Doors, But Maybe Not Forever - Kotaku Australia",https://news.google.com/rss/articles/CBMibWh0dHBzOi8vd3d3LmtvdGFrdS5jb20uYXUvMjAyNC8wNi9hLW1ham9yLWF1c3RyYWxpYW4tZ2FtZXMtc3R1ZGlvLWlzLWNsb3NpbmctaXRzLWRvb3JzLWJ1dC1tYXliZS1ub3QtZm9yZXZlci_SAQA?oc=5&hl=en-US&gl=US&ceid=US:en,21
Press Start Australia,2024_06_13_02,PS5 Slim Consoles And PlayStation VR2 Are Going For Their Best Ever Prices Right Now - Press Start Australia,https://news.google.com/rss/articles/CBMivgFodHRwczovL3ByZXNzLXN0YXJ0LmNvbS5hdS9iYXJnYWlucy8yMDI0LzA2LzExL2JpZy13LWhhcy1yaXBwZXItZGVhbHMtb24tcHM1LWNvbnNvbGVzLWFuZC1wbGF5c3RhdGlvbi12cjItcmlnaHQtbm93YmlnLXctd2lsbC1oYXZlLXJpcHBlci1kZWFscy1vbi1wczUtY29uc29sZXMtYW5kLXBsYXlzdGF0aW9uLXZyMi1uZXh0LXdlZWsv0gHCAWh0dHBzOi8vcHJlc3Mtc3RhcnQuY29tLmF1L2JhcmdhaW5zLzIwMjQvMDYvMTEvYmlnLXctaGFzLXJpcHBlci1kZWFscy1vbi1wczUtY29uc29sZXMtYW5kLXBsYXlzdGF0aW9uLXZyMi1yaWdodC1ub3diaWctdy13aWxsLWhhdmUtcmlwcGVyLWRlYWxzLW9uLXBzNS1jb25zb2xlcy1hbmQtcGxheXN0YXRpb24tdnIyLW5leHQtd2Vlay9hbXAv?oc=5&hl=en-US&gl=US&ceid=US:en,22
news.com.au,2024_06_13_02,Details of star YouTuber’s death revealed - news.com.au,https://news.google.com/rss/articles/CBMinwFodHRwczovL3d3dy5uZXdzLmNvbS5hdS9lbnRlcnRhaW5tZW50L2NlbGVicml0eS1saWZlL2NlbGVicml0eS1kZWF0aHMvY2lyY3Vtc3RhbmNlcy1vZi1oaXQteW91dHViZXJzLWRlYXRoLXJldmVhbGVkL25ld3Mtc3RvcnkvYWE2M2NlOWQ0OGRkNTIyOGU5ZDY5MjlkNDc1MmQ5ZTTSAaMBaHR0cHM6Ly93d3cubmV3cy5jb20uYXUvZW50ZXJ0YWlubWVudC9jZWxlYnJpdHktbGlmZS9jZWxlYnJpdHktZGVhdGhzL2NpcmN1bXN0YW5jZXMtb2YtaGl0LXlvdXR1YmVycy1kZWF0aC1yZXZlYWxlZC9uZXdzLXN0b3J5L2FhNjNjZTlkNDhkZDUyMjhlOWQ2OTI5ZDQ3NTJkOWU0P2FtcA?oc=5&hl=en-US&gl=US&ceid=US:en,23
news.com.au,2024_06_13_02,Pitt ‘devastated’ over daughter’s move - news.com.au,https://news.google.com/rss/articles/CBMixQFodHRwczovL3d3dy5uZXdzLmNvbS5hdS9lbnRlcnRhaW5tZW50L2NlbGVicml0eS1saWZlL2NlbGVicml0eS1raWRzL2RldmFzdGF0ZWQtYnJhZC1waXR0LXNlZXMtc2hpbG9ocy1uYW1lLWNoYW5nZS1hcy1zeW1ib2wtb2YtZGVlcGVyLWVzdHJhbmdlbWVudC1yZXBvcnQvbmV3cy1zdG9yeS81N2U4YjY0MzI3YTlhZjBiM2RmYTdjNGViNDMyYjk1NNIByQFodHRwczovL3d3dy5uZXdzLmNvbS5hdS9lbnRlcnRhaW5tZW50L2NlbGVicml0eS1saWZlL2NlbGVicml0eS1raWRzL2RldmFzdGF0ZWQtYnJhZC1waXR0LXNlZXMtc2hpbG9ocy1uYW1lLWNoYW5nZS1hcy1zeW1ib2wtb2YtZGVlcGVyLWVzdHJhbmdlbWVudC1yZXBvcnQvbmV3cy1zdG9yeS81N2U4YjY0MzI3YTlhZjBiM2RmYTdjNGViNDMyYjk1ND9hbXA?oc=5&hl=en-US&gl=US&ceid=US:en,24
realestate.com.au,2024_06_13_02,Broke Kevin Spacey forced to sell $10m home - realestate.com.au - realestate.com.au,https://news.google.com/rss/articles/CBMiTmh0dHBzOi8vd3d3LnJlYWxlc3RhdGUuY29tLmF1L25ld3MvYnJva2Uta2V2aW4tc3BhY2V5LWZvcmNlZC10by1zZWxsLTEwbS1ob21lL9IBAA?oc=5&hl=en-US&gl=US&ceid=US:en,25
news.com.au,2024_06_13_02,TV boss reveals ‘issue’ behind cult show - news.com.au,https://news.google.com/rss/articles/CBMimgFodHRwczovL3d3dy5uZXdzLmNvbS5hdS9lbnRlcnRhaW5tZW50L3R2L2V1cGhvcmlhLWNyZWF0b3Itc2FtLWxldmluc29uLWhhdmluZy1pc3N1ZXMtd2l0aC1zZWFzb24tdGhyZWUtaGJvLWNlby9uZXdzLXN0b3J5Lzc3NzAzY2RmYTNmZjAxOTk4NWMzZWM1ODFjMGU4NWRl0gGeAWh0dHBzOi8vd3d3Lm5ld3MuY29tLmF1L2VudGVydGFpbm1lbnQvdHYvZXVwaG9yaWEtY3JlYXRvci1zYW0tbGV2aW5zb24taGF2aW5nLWlzc3Vlcy13aXRoLXNlYXNvbi10aHJlZS1oYm8tY2VvL25ld3Mtc3RvcnkvNzc3MDNjZGZhM2ZmMDE5OTg1YzNlYzU4MWMwZTg1ZGU_YW1w?oc=5&hl=en-US&gl=US&ceid=US:en,26
Yahoo Sport Australia,2024_06_13_02,Adam Zampa makes Aussie history in never-before-seen feat at T20 World Cup - Yahoo Sport Australia,https://news.google.com/rss/articles/CBMifWh0dHBzOi8vYXUuc3BvcnRzLnlhaG9vLmNvbS9hZGFtLXphbXBhLW1ha2VzLWF1c3NpZS1jcmlja2V0LWhpc3RvcnktaW4tbmV2ZXItYmVmb3JlLXNlZW4tZmVhdC1hdC10MjAtd29ybGQtY3VwLTA0MzI0NjUzMS5odG1s0gEA?oc=5&hl=en-US&gl=US&ceid=US:en,27
Coffs Coast Advocate,2024_06_13_02,Expansion shock: Perth on track to trump PNG as NRL’s 18th team - Coffs Coast Advocate,https://news.google.com/rss/articles/CBMi0gFodHRwczovL3d3dy5kYWlseXRlbGVncmFwaC5jb20uYXUvc3BvcnQvbnJsL25ybC1leHBhbnNpb24tc2hvY2std2l0aC1wZXJ0aC1vbi10cmFjay10by1iZWNvbWUtMTh0aC10ZWFtLWluLXBvc3NpYmxlLWFsbGlhbmNlLXdpdGgtbmV3dG93bi1qZXRzLW92ZXItbm9ydGgtc3lkbmV5LWJlYXJzL25ld3Mtc3RvcnkvNGE3ZjRjMGQzOTY0MWM3NWZjYjIxYWY4NWFjMGM3MTHSAQA?oc=5&hl=en-US&gl=US&ceid=US:en,28
Sydney Morning Herald,2024_06_13_02,"Australian Olympic swimming trials 2024 LIVE updates: Paris 2024, Olympic Games, Paralympic Games, results, time, program, entertainment, how to watch - Sydney Morning Herald",https://news.google.com/rss/articles/CBMijAFodHRwczovL3d3dy5zbWguY29tLmF1L3Nwb3J0L3N3aW1taW5nL2F1c3RyYWxpYW4tc3dpbW1pbmctdHJpYWxzLWxpdmUtdGl0bXVzLW8tY2FsbGFnaGFuLXNob3dkb3duLWhlYWRsaW5lcy1uaWdodC10aHJlZS0yMDI0MDYxMi1wNWpsMjkuaHRtbNIBAA?oc=5&hl=en-US&gl=US&ceid=US:en,29
Fox Sports,2024_06_13_02,"Tigers set to hand 19yo, 131kg beast debut jersey — Rd 15 Early Mail - Fox Sports",https://news.google.com/rss/articles/CBMi0QFodHRwczovL3d3dy5mb3hzcG9ydHMuY29tLmF1L25ybC9ucmwtcHJlbWllcnNoaXAvbnJsLTIwMjQtcm91bmQtMTUtZWFybHktbWFpbC1sYXRlLW1haWwtaW5zLWFuZC1vdXRzLXRlYW1zLXdob3MtcGxheWluZy1pbmp1cmllcy1uZXdzLXVwZGF0ZXMtam9yZGFuLW1pbGxlci1hbGV4LXR3YWwvbmV3cy1zdG9yeS84MGYzOWRmMmFkODAyYTNkOThmZTY5YTU5MGQ1N2M0NNIB0QFodHRwczovL3d3dy5mb3hzcG9ydHMuY29tLmF1L25ybC9ucmwtcHJlbWllcnNoaXAvbnJsLTIwMjQtcm91bmQtMTUtZWFybHktbWFpbC1sYXRlLW1haWwtaW5zLWFuZC1vdXRzLXRlYW1zLXdob3MtcGxheWluZy1pbmp1cmllcy1uZXdzLXVwZGF0ZXMtam9yZGFuLW1pbGxlci1hbGV4LXR3YWwvbmV3cy1zdG9yeS84MGYzOWRmMmFkODAyYTNkOThmZTY5YTU5MGQ1N2M0NA?oc=5&hl=en-US&gl=US&ceid=US:en,30
Mirage News,2024_06_13_02,Nottingham Scientist Bags Royal Society Chemistry Prize - Mirage News,https://news.google.com/rss/articles/CBMiS2h0dHBzOi8vd3d3Lm1pcmFnZW5ld3MuY29tL25vdHRpbmdoYW0tc2NpZW50aXN0LWJhZ3Mtcm95YWwtc29jaWV0eS0xMjU0NDMyL9IBAA?oc=5&hl=en-US&gl=US&ceid=US:en,31
The Conversation Indonesia,2024_06_13_02,100-million-year-old fossil find reveals huge flying reptile that patrolled Australia's inland sea - The Conversation Indonesia,https://news.google.com/rss/articles/CBMihAFodHRwczovL3RoZWNvbnZlcnNhdGlvbi5jb20vMTAwLW1pbGxpb24teWVhci1vbGQtZm9zc2lsLWZpbmQtcmV2ZWFscy1odWdlLWZseWluZy1yZXB0aWxlLXRoYXQtcGF0cm9sbGVkLWF1c3RyYWxpYXMtaW5sYW5kLXNlYS0yMzEzOTPSAQA?oc=5&hl=en-US&gl=US&ceid=US:en,32
The Peter Doherty Institute for Infection and Immunity,2024_06_13_02,Innovative sulfosugar research earns international team prestigious prize from the Royal Society of Chemistry - The Peter Doherty Institute for Infection and Immunity,https://news.google.com/rss/articles/CBMia2h0dHBzOi8vd3d3LmRvaGVydHkuZWR1LmF1L25ld3MtZXZlbnRzL25ld3MvaW5ub3ZhdGl2ZS1zdWxmb3N1Z2FyLXJlc2VhcmNoLXJveWFsLXNvY2lldHktb2YtY2hlbWlzdHJ5LXByaXpl0gEA?oc=5&hl=en-US&gl=US&ceid=US:en,33
